大同區,建物,臺北市大同區市民大道一段211號11樓之9,0.0,其他,,,1100324,土地0建物1車位0,十一層,18,套房(1房1廳1衛),見其他登記事項,見其他登記事項,0980724,54.230000000000004,1,1,1,有,有,有,35000,645,,0.0,0,,RPPQMLRJNHGGFBA67CC
大同區,建物,臺北市大同區南京西路288號8樓之16,0.0,商,,,1100421,土地0建物1車位0,八層,19,住宅大樓(11層含以上有電梯),見其他登記事項,鋼筋混凝土造,1011214,201.31,3,2,2,有,有,有,87000,432,,0.0,0,,RPQQMLRJNHGGFBA77CC
內湖區,建物,臺北市內湖區文德路232號1樓,0.0,住,,,1100421,土地0建物1車位0,一層,8,店面(店鋪),商業用,鋼筋混凝土造,0781019,121.28,0,0,0,無,有,有,70000,577,,0.0,0,,RPPNMLRJNHGGFCA47CC
內湖區,建物,臺北市內湖區康樂街１３６巷３０弄１３號九樓,0.0,住,,,1100425,土地0建物1車位1,九層,15,住宅大樓(11層含以上有電梯),見其他登記事項,鋼筋混凝土造,1090424,184.51,3,2,2,有,有,有,40000,217,坡道平面,35.06,0,租金含管理費。承租車位為所有權人同社區他戶產權之車位，面積依謄本面積登錄。,RPQNMLRJNHGGFCA57CC
中山區,建物,臺北市中山區松江路164巷22號1樓,0.0,住,,,1100412,土地0建物1車位0,一層,6,華廈(10層含以下有電梯),住家用,鋼筋混凝土造,0611205,170.9,0,0,0,無,無,無,52500,307,,0.0,0,,RPUNMLRJNHGGFCA97CC
中山區,建物,臺北市中山區伊通街1號6樓之1,0.0,商,,,1100412,土地0建物1車位0,六層,9,華廈(10層含以下有電梯),住家用,鋼筋混凝土造,1070426,64.92,2,2,1,有,有,有,50000,770,,0.0,0,續租。；含管理費、稅金或水電等費用。；,RPOOMLRJNHGGFCA47CC
中山區,建物,臺北市中山區樂群二路189號8樓-1,0.0,其他,,,1100504,土地0建物1車位3,八層,11,辦公商業大樓,見其他登記事項,見其他登記事項,1040310,538.0699999999999,7,0,0,有,有,有,280000,520,坡道平面,122.49,0,,RPXOMLRJNHGGFCA38CC
中山區,房地(土地+建物)+車位,臺北市中山區中山北路二段93巷26號2樓,0.0,商,,,1100309,土地1建物1車位1,二層,12,住宅大樓(11層含以上有電梯),住家用,鋼筋混凝土造,1020111,229.75,2,0,2,有,有,有,65000,283,坡道平面,49.45,0,,RPVPMLRJNHGGFCA28CC
中山區,建物,臺北市中山區中山北路二段168之5號7樓,0.0,商,,,1100420,土地0建物1車位0,七層,14,住宅大樓(11層含以上有電梯),住家用,鋼骨鋼筋混凝土造,0951129,58.28,1,2,1,有,有,有,30000,515,,0.0,0,,RPXPMLRJNHGGFCA48CC
中山區,建物,臺北市中山區林森北路587號7樓之1,0.0,商,,,1100420,土地0建物1車位0,七層,13,住宅大樓(11層含以上有電梯),住家用,鋼筋混凝土造,1000726,89.73,2,2,1,有,有,有,50000,557,,0.0,0,含管理費、稅金或水電等費用。；,RPOQMLRJNHGGFCA67CC
中山區,建物,臺北市中山區林森北路587號6樓之3,0.0,商,,,1100422,土地0建物1車位0,六層,13,住宅大樓(11層含以上有電梯),住家用,鋼筋混凝土造,1000726,89.44,1,2,1,有,有,有,63000,704,,0.0,0,續租。；含管理費、稅金或水電等費用。；,RPPQMLRJNHGGFCA77CC
中山區,車位,臺北市中山區林森北路585號地下5樓,0.0,商,,,1100422,土地0建物0車位1,,0,其他,見其他登記事項,鋼筋混凝土造,1000726,39.18,0,0,0,有,有,無,6000,,坡道平面,39.18,6000,含管理費、稅金或水電等費用。；,RPTQMLRJNHGGFCA18CC
中山區,建物,臺北市中山區南京東路二段108號10樓之2,0.0,其他,,,1100419,土地0建物1車位0,十層,18,套房(1房1廳1衛),住家用,見其他登記事項,0990917,49.95,1,1,1,有,有,有,35000,701,,0.0,0,,RPUQMLRJNHGGFCA28CC
中山區,建物,臺北市中山區中山北路二段77巷17號7樓,0.0,商,,,1100424,土地0建物1車位0,七層,12,住宅大樓(11層含以上有電梯),住家用,鋼筋混凝土造,0981027,110.05000000000001,2,2,1,有,有,有,56000,509,,0.0,0,續租。；,RPVQMLRJNHGGFCA38CC
中山區,建物,臺北市中山區天祥路80號9樓之3,0.0,商,,,1100413,土地0建物1車位0,九層,14,住宅大樓(11層含以上有電梯),住家用,鋼筋混凝土造,0931203,53.96,1,1,1,有,有,有,27000,500,,0.0,0,租金含稅不含管理費,RPWQMLRJNHGGFCA48CC
中山區,建物,臺北市中山區林森北路363號16樓之1,0.0,商,,,1100425,土地0建物1車位0,十六層,18,住宅大樓(11層含以上有電梯),商業用,鋼筋混凝土造,0980916,103.91,2,2,1,有,有,有,68000,654,,0.0,0,續租。；含管理費、稅金或水電等費用。；,RPQRMLRJNHGGFCA97CC
中山區,建物,臺北市中山區林森北路585號8樓,0.0,商,,,1100425,土地0建物1車位0,八層,13,住宅大樓(11層含以上有電梯),住家用,鋼筋混凝土造,1000726,184.44,3,2,2,有,有,有,98500,534,,0.0,0,續租。；含管理費、稅金或水電等費用。；,RPRRMLRJNHGGFCA08CC
中山區,建物,臺北市中山區長安東路一段22之3號8樓及地下4樓車位21號,0.0,商,,,1100421,土地0建物1車位1,八層,14,住宅大樓(11層含以上有電梯),住家用,鋼筋混凝土造,0960904,204.45000000000002,3,2,2,有,有,有,95000,465,坡道平面,0.0,0,,RPSRMLRJNHGGFCA18CC
內湖區,建物,臺北市內湖區行忠路60號8樓之1,0.0,其他,,,1100423,土地0建物1車位2,八層,8,廠辦,見其他登記事項,鋼筋混凝土造,0971009,360.77,0,0,1,有,有,無,95000,263,坡道平面,63.34,0,含稅 含管理費,RPTRMLRJNHGGFCA28CC
中山區,建物,臺北市中山區南京東路二段192號12樓,0.0,商,,,1100423,土地0建物1車位0,十二層,15,住宅大樓(11層含以上有電梯),住家用,鋼筋混凝土造,0990528,136.03,3,2,2,有,有,有,110000,809,,0.0,0,每月含水、電、瓦斯、電視收視、網路及清潔費。,RPURMLRJNHGGFCA38CC
中山區,建物,臺北市中山區敬業一路１２８巷２２號五樓,0.0,商,,,1100429,土地0建物1車位0,五層,10,辦公商業大樓,商業用,鋼骨鋼筋混凝土造,0930507,305.5,2,2,2,有,有,有,74500,244,,0.0,0,租金調漲：第一年租期，每月應繳月租金新台幣74500元整（含稅、含健保補充保費）。第二年租期，每月應繳月租金新台幣76500元整（含稅、含健保補充保費）。第三年租期，每月應繳月租金新台幣78000元整（含稅、含健保補充保費）。,RPVRMLRJNHGGFCA48CC
中山區,建物,臺北市中山區樂群二路１６６號二樓,0.0,住,,,1100429,土地0建物1車位1,二層,8,華廈(10層含以下有電梯),住家用,鋼筋混凝土造,0890628,191.57999999999998,3,2,2,有,有,有,42000,219,坡道平面,0.0,0,,RPWRMLRJNHGGFCA58CC
中山區,建物,臺北市中山區雙城街13巷11號4樓,0.0,商,,,1100413,土地0建物1車位0,四層,15,住宅大樓(11層含以上有電梯),住家用,鋼筋混凝土造,1010327,174.39,2,2,2,有,有,有,81000,464,,0.0,0,含管理費、稅金或水電等費用。；,RPPNMLSJNHGGFCA57CC
中山區,建物,臺北市中山區中山北路二段42巷18號6樓之1,0.0,住,,,1100415,土地0建物1車位0,六層,8,華廈(10層含以下有電梯),住家用,鋼筋混凝土造,1081224,66.08,2,2,1,有,有,有,50000,757,,0.0,0,含管理費、稅金或水電等費用。；,RPQNMLSJNHGGFCA67CC
中山區,建物,臺北市中山區新生北路二段58巷6號7樓之2,0.0,商,,,1100504,土地0建物1車位0,七層,12,住宅大樓(11層含以上有電梯),商業用,鋼筋混凝土造,0740320,29.79,0,0,0,無,有,有,12500,420,,0.0,0,,RPRNMLSJNHGGFCA77CC
中山區,建物,臺北市中山區林森北路538號7樓之4,0.0,商,,,1100417,土地0建物1車位0,七層,14,住宅大樓(11層含以上有電梯),住家用,鋼筋混凝土造,0940826,48.120000000000005,2,2,1,有,有,有,35000,727,,0.0,0,含管理費、稅金或水電等費用。；,RPSNMLSJNHGGFCA87CC
中山區,建物,臺北市中山區林森北路107巷67號3樓,0.0,商,,,1100504,土地0建物1車位0,三層,7,華廈(10層含以下有電梯),見其他登記事項,鋼筋混凝土造,1010210,82.87,2,1,1,有,有,有,43000,519,,0.0,0,,RPTNMLSJNHGGFCA97CC
中山區,建物,臺北市中山區南京東路二段24巷8號2樓之1,0.0,商,,,1100422,土地0建物1車位0,二層,8,套房(1房1廳1衛),商業用,鋼筋混凝土造,0931209,42.3,1,1,1,有,有,有,30000,709,,0.0,0,含管理費、稅金或水電等費用。；,RPUNMLSJNHGGFCA08CC
中山區,建物,臺北市中山區中山北路二段115巷30號7樓之1,0.0,商,,,1100423,土地0建物1車位0,七層,7,華廈(10層含以下有電梯),住家用,鋼筋混凝土造,0991110,77.86,1,1,1,有,有,有,38000,488,,0.0,0,含管理費、稅金或水電等費用。；,RPVNMLSJNHGGFCA18CC
中山區,建物,臺北市中山區新生北路三段56巷19號2樓之3,0.0,商,,,1100423,土地0建物1車位0,二層,13,住宅大樓(11層含以上有電梯),住家用,鋼筋混凝土造,0981021,139.69,3,2,2,有,有,有,75758,542,,0.0,0,,RPXNMLSJNHGGFCA38CC
中山區,建物,臺北市中山區中山北路二段118號6樓之3,0.0,商,,,1100417,土地0建物1車位0,六層,14,住宅大樓(11層含以上有電梯),住家用,鋼筋混凝土造,1080227,70.12,2,2,1,有,有,有,65000,927,,0.0,0,含管理費、稅金或水電等費用。；,RPOOMLSJNHGGFCA57CC
松山區,房地(土地+建物),臺北市松山區撫遠街259號2樓,40.75,住,,,1100414,土地1建物1車位0,二層,4,公寓(5樓含以下無電梯),住家用,鋼筋混凝土造,0710824,107.48,3,2,2,有,無,無,30000,279,,0.0,0,,RPQNMLSJNHGGFDA77CC
士林區,建物,臺北市士林區天母西路38巷8號6樓,0.0,商,,,1100416,土地0建物1車位0,六層,7,華廈(10層含以下有電梯),住家用,鋼筋混凝土造,1070125,84.35,2,2,2,有,有,有,71000,842,,0.0,0,含管理費、稅金或水電等費用。；,RPPNMLSJNHGGFEA77CC
士林區,建物,臺北市士林區中山北路六段212之2號10樓,0.0,住,,,1100424,土地0建物1車位0,十層,14,住宅大樓(11層含以上有電梯),住家用,鋼骨鋼筋混凝土造,0930518,230.82,3,2,2,有,有,有,89170,386,,0.0,0,租賃範圍不含車位，且無法區分車位面積。；含管理費、稅金或水電等費用。；,RPQNMLSJNHGGFEA87CC
中山區,建物,臺北市中山區中山北路三段25號10樓之4,0.0,商,,,1100417,土地0建物1車位0,十層,14,住宅大樓(11層含以上有電梯),住家用,鋼筋混凝土造,0670121,35.41,1,0,0,無,有,有,13500,381,,0.0,0,,RPPNMLTJNHGGFCA67CC
中山區,建物,臺北市中山區民權東路3段21號2樓之1，2樓之2,0.0,商,,,1100415,土地0建物2車位0,二層,7,華廈(10層含以下有電梯),住商用,鋼筋混凝土造,0671214,217.84,4,1,2,有,有,無,90000,413,,0.0,0,含增建或未登記建物。；第1-5年租金90000元/月第6年租金95000元/月,RPQNMLTJNHGGFCA77CC
內湖區,建物,臺北市內湖區成功路四段１６７巷１號五樓之３,0.0,住,,,1100430,土地0建物1車位0,五層,17,住宅大樓(11層含以上有電梯),住家用,鋼筋混凝土造,0940627,218.27,4,2,2,有,有,有,60000,275,,0.0,0,,RPQOMLKKNHGGFCA07CC
中山區,建物,臺北市中山區林森北路585號6樓之2,0.0,商,,,1100419,土地0建物1車位0,六層,13,住宅大樓(11層含以上有電梯),住家用,鋼筋混凝土造,1000726,147.9,2,2,2,有,有,有,73000,494,,0.0,0,含管理費、稅金或水電等費用。；,RPXOMLKKNHGGFCA77CC
中山區,建物,臺北市中山區民生東路三段36號3樓之6,0.0,商,,,1100324,土地0建物1車位0,三層,9,辦公商業大樓,商業用,鋼筋混凝土造,0850202,56.66,0,1,1,有,無,有,31391,554,,0.0,0,,RPRPMLKKNHGGFCA27CC
中山區,建物,臺北市中山區中山北路三段1號,0.0,商,,,1100326,土地0建物1車位0,一層,3,店面(店鋪),住商用,見其他登記事項,,96.55,0,1,1,有,無,無,100000,1036,,0.0,0,,RPOQMLKKNHGGFCA07CC
中山區,房地(土地+建物),臺北市中山區松江路362巷30號6樓,26.84,住,,,1100504,土地1建物1車位0,六層,6,華廈(10層含以下有電梯),住家用,鋼筋混凝土造,0740629,130.97,4,2,2,有,有,有,43000,328,,0.0,0,,RPRQMLKKNHGGFCA37CC
中山區,建物,臺北市中山區南京東路二段137號7樓,19.2,商,,,1100324,土地0建物1車位0,七層,14,辦公商業大樓,商業用,鋼筋混凝土造,0670810,205.69,0,0,0,無,有,無,112000,545,,0.0,0,含管理費、稅金或水電等費用。；部份承租/租金含管理費/含稅,RPSQMLKKNHGGFCA47CC
中山區,建物,臺北市中山區林森北路３７２號６樓之１,0.0,商,,,1100429,土地0建物1車位0,六層,11,辦公商業大樓,商業用,鋼骨鋼筋混凝土造,0610613,443.34,0,0,0,無,有,無,170000,383,,0.0,0,,RPTQMLKKNHGGFCA57CC
中山區,建物,臺北市中山區新生北路二段36號六樓之4,0.0,商,,,1100503,土地0建物1車位0,六層,17,住宅大樓(11層含以上有電梯),商業用,鋼筋混凝土造,0850718,68.1,2,1,1,有,有,無,25000,367,,0.0,0,,RPUQMLKKNHGGFCA67CC
信義區,建物,臺北市信義區吳興街600巷76弄74號地下二樓之2,0.0,住,,,1100508,土地0建物1車位0,地下二層,5,公寓(5樓含以下無電梯),商業用,鋼筋混凝土造,0830310,37.8,1,1,1,有,無,無,11000,291,,0.0,0,,RPUNMLKKNHGGFDA47CC
信義區,建物,臺北市信義區富陽街４０號,0.0,住,,,1100430,土地0建物1車位0,見其他登記事項,5,公寓(5樓含以下無電梯),住家用,鋼筋混凝土造,,154.18,0,4,1,有,無,無,42000,272,,0.0,0,含增建或未登記建物。；租賃期間含免租金裝潢期。房屋用途做辦公室使用。,RPVNMLKKNHGGFDA57CC
信義區,建物,臺北市信義區基隆路二段189號6樓之4,0.0,商,,,1100429,土地0建物2車位0,六層,21,辦公商業大樓,見使用執照,鋼筋混凝土造,0860221,236.13,0,0,0,無,有,無,130000,551,,0.0,0,,RPUOMLKKNHGGFDA57CC
大同區,建物,臺北市大同區民生西路112號7樓之2,0.0,商,,,1100415,土地0建物1車位1,七層,13,住宅大樓(11層含以上有電梯),住家用,鋼筋混凝土造,1020826,146.78,3,2,2,有,有,有,70000,477,坡道平面,21.51,0,續租。；含管理費、稅金或水電等費用。；,RPSOMLKKNHGGFBA17CC
中正區,建物,臺北市中正區忠孝東路一段9號4樓,0.0,商,,,1100413,土地0建物1車位0,四層,12,辦公商業大樓,商業用,鋼筋混凝土造,0740731,468.2,0,0,0,無,有,無,235000,502,,0.0,0,,RPWOMLKKNHGGFBA57CC
大同區,建物,臺北市大同區延平北路一段51號八樓之31,0.0,商,,,1100505,土地0建物1車位0,八層,11,住宅大樓(11層含以上有電梯),商業用,鋼筋混凝土造,0700223,22.39,0,0,0,無,有,有,10000,447,,0.0,0,,RPSPMLKKNHGGFBA27CC
北投區,房地(土地+建物)+車位,臺北市北投區崇仰二路3號,282.0,住,,,1100501,土地1建物1車位1,全,1,透天厝,住家用,加強磚造,0540430,217.47,3,2,3,有,無,有,156000,717,一樓平面,0.0,0,,RPUNMLKKNHGGFEA57CC
士林區,建物,臺北市士林區通河街４０號,0.0,住,,,1100421,土地0建物1車位0,一層,7,店面(店鋪),見使用執照,鋼筋混凝土造,0730615,141.72,0,0,0,無,無,無,50000,353,,0.0,0,租賃期間含免租金裝潢期。租金調漲：前貳年即民國110年08月01日至民國112年07月31日每月租金新台幣伍萬元含稅。後參年即民國112年08月01日至民國115年07月31日每月租金新台幣伍萬參仟元含稅。,RPXNMLKKNHGGFEA87CC
北投區,建物,臺北市北投區東華街一段502號4樓之1,0.0,商,,,1100325,土地0建物1車位0,四層,13,住宅大樓(11層含以上有電梯),住家用,鋼筋混凝土造,0941111,161.42000000000002,3,2,2,有,有,有,85000,527,,0.0,0,,RPWOMLKKNHGGFEA87CC
北投區,建物,臺北市北投區大業路280巷9弄12之1號二樓,0.0,住,,,1100506,土地0建物1車位0,二層,4,公寓(5樓含以下無電梯),住家用,鋼筋混凝土造,0671223,75.36,3,1,1,有,無,有,20000,265,,0.0,0,,RPXOMLKKNHGGFEA97CC
北投區,建物,臺北市北投區溫泉路37巷26號四樓之1,0.0,住,,,1100507,土地0建物1車位0,四層,13,住宅大樓(11層含以上有電梯),住家用,鋼筋混凝土造,0941111,42.11,0,0,0,無,有,有,12200,290,,0.0,0,1.公會版社會住宅案件2.合約面積規定不含車位故合約面積42.11,RPQPMLKKNHGGFEA37CC
士林區,建物,臺北市士林區士東路46巷19號4樓,0.0,住,,,1100401,土地0建物1車位0,四層,9,華廈(10層含以下有電梯),住家用,鋼筋混凝土造,0931201,200.01999999999998,3,2,2,有,有,有,90000,450,,0.0,0,含管理費、稅金或水電等費用。；,RPRPMLKKNHGGFEA47CC
中正區,建物,臺北市中正區辛亥路一段６號十三樓之３,0.0,住,,,1100423,土地0建物1車位0,十三層,15,住宅大樓(11層含以上有電梯),見其他登記事項,鋼筋混凝土造,1070717,138.8,1,2,2,有,有,有,48000,346,,0.0,0,租金含管理費。,RPOOMLKKNHGGFAA66CC
大安區,建物,臺北市大安區復興南路一段90號9樓之2-C室,9.98,商,,,1100406,土地0建物0車位0,九層,16,住宅大樓(11層含以上有電梯),住家用,鋼筋混凝土造,0701230,20.490000000000002,1,0,0,有,有,有,9000,439,,0.0,0,,RPOOMLKKNHGGFFA17CC
大安區,建物,臺北市大安區敦化南路二段６３巷３６號四樓,0.0,住,,,1100430,土地0建物1車位0,四層,5,華廈(10層含以下有電梯),住家用,鋼筋混凝土造,0810326,60.440000000000005,2,1,1,有,無,有,27000,447,,0.0,0,含增建或未登記建物。；,RPSOMLKKNHGGFFA57CC
信義區,建物,臺北市信義區忠孝東路五段508號11樓之1,0.0,住,,,1100423,土地0建物1車位0,十一層,28,辦公商業大樓,商業用,鋼骨混凝土造,0820813,202.51,4,0,2,有,有,有,85000,420,,0.0,0,,RPOOMLKKNHGGFDA07DC
大安區,建物,臺北市大安區台北市大安區仁愛路4段50之24號五樓,0.0,其他,,,1100427,土地0建物1車位0,五層,12,住宅大樓(11層含以上有電梯),住家用,鋼筋混凝土造,0600420,56.64,2,1,1,有,有,無,30000,530,,0.0,0,,RPWNMLLKNHGGFFA97CC
大安區,建物,臺北市大安區濟南路三段37號二樓,0.0,住,,,1100428,土地0建物1車位0,二層,7,華廈(10層含以下有電梯),住家用,鋼筋混凝土造,0990728,175.47,2,2,2,有,有,有,67500,385,,0.0,0,,RPXNMLLKNHGGFFA08CC
大安區,建物,臺北市大安區忠孝東路四段49巷4弄16號4樓之3,0.0,商,,,1100428,土地0建物1車位0,四層,12,住宅大樓(11層含以上有電梯),住家用,鋼筋混凝土造,,113.66,2,1,1,有,無,有,45000,396,,0.0,0,,RPOOMLLKNHGGFFA27CC
大安區,建物,臺北市大安區瑞安街208巷39號4樓之2,0.0,住,,,1100427,土地0建物1車位0,四層,7,華廈(10層含以下有電梯),住家用,鋼筋混凝土造,1040511,44.22,0,0,0,無,無,有,25000,565,,0.0,0,,RPSOMLLKNHGGFFA67CC
大安區,建物,臺北市大安區安和路一段11號8樓,0.0,商,,,1100402,土地0建物1車位0,八層,12,住宅大樓(11層含以上有電梯),住家用,鋼筋混凝土造,0670224,185.32,2,1,2,有,無,無,88800,479,,0.0,0,,RPUOMLLKNHGGFFA87CC
文山區,建物,臺北市文山區忠順街一段26巷30弄12號5樓,0.0,住,,,1100406,土地0建物1車位0,五層,6,華廈(10層含以下有電梯),住家用,鋼筋混凝土造,0850201,231.24,4,2,2,有,無,無,40000,173,,0.0,0,,RPTOMLLKNHGGFAA27CC
文山區,建物,臺北市文山區木新路三段155巷3號4樓,0.0,住,,,1100511,土地0建物1車位0,見其他登記事項,7,華廈(10層含以下有電梯),住家用,鋼筋混凝土造,0870717,244.45,5,3,3,有,無,無,43000,176,,0.0,0,1.租賃範圍：房屋全部公設含一位機械平面車位。2.租金含稅、二代健保、管理費、車位。,RPUPMLLKNHGGFAA47CC
文山區,建物,臺北市文山區光輝路50巷3弄15號,0.0,住,,,1100428,土地0建物1車位0,一層,5,公寓(5樓含以下無電梯),商業用,鋼筋混凝土造,0710615,119.25,3,2,2,有,無,有,32000,268,,0.0,0,國家住宅及都市更新中心108年社會住宅包租代管第二期計畫,RPXPMLLKNHGGFAA77CC
文山區,建物,臺北市文山區木柵路三段85巷25弄4之1號三樓,0.0,住,,,1100416,土地0建物1車位0,三層,4,公寓(5樓含以下無電梯),住家用,鋼筋混凝土造,,113.11,4,2,2,有,無,有,29000,256,,0.0,0,國家住宅及都市更新中心108年社會住宅包租代管第二期計畫,RPOQMLLKNHGGFAA96CC
中正區,房地(土地+建物),臺北市中正區金門街2號1樓,3.13,其他,,,1100415,土地1建物1車位0,一層,24,店面(店鋪),見其他登記事項,鋼骨鋼筋混凝土造,1060425,52.269999999999996,1,1,1,有,有,有,50000,957,,0.0,0,,RPQQMLLKNHGGFAA17CC
大同區,建物,臺北市大同區南京西路57號12樓之9,0.0,其他,,,1100429,土地0建物1車位1,十二層,19,住宅大樓(11層含以上有電梯),住家用,鋼筋混凝土造,1080304,114.55000000000001,2,2,1,有,無,有,64642,564,坡道機械,0.0,0,,RPQOMLLKNHGGFBA07CC
萬華區,建物,臺北市萬華區長沙街二段114號9樓,0.0,商,,,1100423,土地0建物1車位0,九層,11,住宅大樓(11層含以上有電梯),住家用,鋼筋混凝土造,0780125,120.66,3,2,2,有,無,無,33000,273,,0.0,0,,RPROMLLKNHGGFBA17CC
大同區,建物,臺北市大同區市民大道一段201號七樓之10,0.0,其他,,,1100417,土地0建物1車位0,七層,18,住宅大樓(11層含以上有電梯),住家用,見其他登記事項,0980724,92.43,2,1,1,有,有,有,50000,541,,0.0,0,租賃範圍不含車位，且無法區分車位面積。；含管理費、稅金或水電等費用。；,RPTOMLLKNHGGFBA37CC
大同區,建物,臺北市大同區市民大道一段205號十五樓之2,0.0,其他,,,1100417,土地0建物1車位0,十五層,18,住宅大樓(11層含以上有電梯),住家用,見其他登記事項,0980724,83.04,1,1,1,有,有,有,58000,698,,0.0,0,租賃範圍不含車位，且無法區分車位面積。；含管理費、稅金或水電等費用。；,RPUOMLLKNHGGFBA47CC
萬華區,建物,臺北市萬華區康定路103號16樓之3,0.0,商,,,1100420,土地0建物1車位0,十六層,26,住宅大樓(11層含以上有電梯),住家用,見其他登記事項,1050331,92.08,2,2,1,有,無,有,38000,413,,0.0,0,,RPWOMLLKNHGGFBA67CC
萬華區,建物,臺北市萬華區長泰街308巷17號三樓,0.0,住,,,1100430,土地0建物1車位0,三層,4,公寓(5樓含以下無電梯),住家用,加強磚造,,78.84,3,2,1,有,無,有,12000,152,,0.0,0,國家住宅及都市更新中心108年社會住宅包租代管第二期計畫,RPPPMLLKNHGGFBA07CC
信義區,建物,臺北市信義區信義路五段119號十三樓之2,0.0,其他,,,1100423,土地0建物1車位0,十三層,19,住宅大樓(11層含以上有電梯),住家用,鋼筋混凝土造,0980702,106.36,1,1,1,有,有,有,80000,752,,0.0,0,,RPUNMLLKNHGGFDA57CC
信義區,建物,臺北市信義區基隆路二段7號五樓之3,0.0,商,,,1100420,土地0建物1車位0,五層,12,辦公商業大樓,商業用,鋼筋混凝土造,0810828,58.88,0,0,0,無,有,無,30000,510,,0.0,0,,RPVNMLLKNHGGFDA67CC
松山區,建物,臺北市松山區南京東路四段118號,0.0,商,,,1100331,土地0建物1車位0,見其他登記事項,15,店面(店鋪),見其他登記事項,鋼骨鋼筋混凝土造,0990831,114.2,0,0,0,無,無,無,120000,1051,,0.0,0,,RPPOMLLKNHGGFDA17CC
松山區,建物,臺北市松山區南京東路三段338巷3號7樓,0.0,其他,,,1100419,土地0建物1車位0,七層,7,華廈(10層含以下有電梯),住家用,鋼筋混凝土造,0710818,211.53,3,0,2,有,無,無,100800,477,,0.0,0,,RPQTMLLKNHGGFDA77CC
信義區,建物,臺北市信義區信義路五段121號12樓之1,0.0,其他,,,1100426,土地0建物1車位0,十二層,19,住宅大樓(11層含以上有電梯),住家用,鋼筋混凝土造,0980702,147.85999999999999,2,2,1,有,無,有,77000,521,,0.0,0,,RPVUMLLKNHGGFDA38CC
內湖區,建物,臺北市內湖區民權東路六段248巷40號,0.0,住,,,1100419,土地0建物1車位1,全,4,透天厝,住家用,鋼筋混凝土造,0900824,301.21,5,3,5,有,有,有,140407,466,坡道平面,15.44,0,,RPVNMLLKNHGGFCA57CC
中山區,建物,臺北市中山區市民大道三段143號2樓,0.0,住,,,1100429,土地0建物1車位0,二層,6,華廈(10層含以下有電梯),商業用,鋼筋混凝土造,0801115,237.22000000000003,0,0,1,有,無,有,100000,422,,0.0,0,,RPQOMLLKNHGGFCA17CC
中山區,建物,臺北市中山區朱崙街34號3樓之8,0.0,住,,,1100425,土地0建物1車位1,三層,5,公寓(5樓含以下無電梯),住家用,鋼筋混凝土造,0850411,46.980000000000004,1,1,1,有,無,有,17500,372,坡道機械,16.77,0,,RPWOMLLKNHGGFCA77CC
內湖區,建物,臺北市內湖區新豐街71號6樓,0.0,住,,,1100429,土地0建物1車位1,六層,8,華廈(10層含以下有電梯),住家用,鋼筋混凝土造,1080530,184.74,3,2,2,有,無,有,60000,325,坡道機械,21.78,0,,RPRPMLLKNHGGFCA37CC
中山區,建物,臺北市中山區復興北路150號10樓之4,0.0,商,,,1100415,土地0建物3車位0,十層,14,辦公商業大樓,商業用,鋼筋混凝土造,0720817,249.81,8,1,0,有,有,無,150000,600,,0.0,0,,RPPQMLLKNHGGFCA27CC
中山區,建物,臺北市中山區復興南路1段36之10號12樓之1,0.0,商,,,1100507,土地0建物1車位0,十二層,14,辦公商業大樓,商業用,鋼筋混凝土造,0910920,163.21,2,1,2,有,有,有,105000,643,,0.0,0,,RPQQMLLKNHGGFCA37CC
中山區,建物,臺北市中山區南京東路二段188號十二樓,0.0,商,,,1100417,土地0建物1車位0,十二層,15,住宅大樓(11層含以上有電梯),住家用,鋼筋混凝土造,0990528,136.03,3,2,2,有,有,有,78000,573,,0.0,0,租賃範圍不含車位，且無法區分車位面積。；含管理費、稅金或水電等費用。；,RPRQMLLKNHGGFCA47CC
中山區,建物,臺北市中山區建國北路2段1號11樓,0.0,商,,,1100412,土地0建物1車位0,十一層,11,辦公商業大樓,商業用,鋼筋混凝土造,0661109,206.85,2,1,2,有,無,有,81920,396,,0.0,0,,RPSQMLLKNHGGFCA57CC
內湖區,建物,臺北市內湖區康寧路三段22之1號四樓,0.0,住,,,1100424,土地0建物1車位0,四層,5,公寓(5樓含以下無電梯),住家用,鋼筋混凝土造,0760919,123.76,3,2,2,有,無,有,30000,242,,0.0,0,國家住宅及都市更新中心108年社會住宅包租代管第二期計畫,RPVQMLLKNHGGFCA87CC
內湖區,建物,臺北市內湖區瑞光路513巷26號4樓之3,0.0,工,,,1100414,土地0建物1車位1,四層,9,廠辦,工業用,鋼筋混凝土造,0871022,314.19,0,0,0,無,有,有,94000,373,坡道平面,70.01,3000,,RPTNMLMKNHGGFCA47CC
