士林區,建物,臺北市士林區華齡街７０號,0.0,住,,,1100402,土地0建物1車位0,一層,5,店面(店鋪),見使用執照,鋼筋混凝土造,0690115,103.39,4,2,2,有,無,無,52000,503,,0.0,0,含增建或未登記建物。；,RPQNMLTKMHGGFEA97CC
士林區,建物,臺北市士林區雨聲街63號,0.0,住,,,1100402,土地0建物1車位0,見其他登記事項,7,華廈(10層含以下有電梯),商業用,鋼筋混凝土造,0751204,227.97000000000003,0,0,1,有,無,有,66000,290,,0.0,0,,RPRNMLTKMHGGFEA08CC
北投區,建物,臺北市北投區光明路２４２號十八樓之８,0.0,其他,,,1100405,土地0建物1車位1,十八層,19,套房(1房1廳1衛),住家用,鋼筋混凝土造,0980818,122.00999999999999,1,1,1,有,有,有,30000,246,坡道平面,40.07,0,,RPTNMLTKMHGGFEA28CC
士林區,建物,臺北市士林區天母東路43巷4弄3號7樓,0.0,商,,,1100310,土地0建物1車位0,七層,7,華廈(10層含以下有電梯),住家用,鋼筋混凝土造,0690325,119.6,3,2,2,有,有,有,77000,644,,0.0,0,,RPRQMLTKMHGGFEA38CC
士林區,建物,臺北市士林區文林路310號,0.0,商,,,1100301,土地0建物1車位0,見其他登記事項,2,店面(店鋪),住家用,加強磚造,0561210,93.33,0,2,1,有,無,無,95000,1018,,0.0,0,,RPSQMLTKMHGGFEA48CC
士林區,建物,臺北市士林區天母西路39之1號二樓,0.0,商,,,1100310,土地0建物1車位0,二層,7,華廈(10層含以下有電梯),住家用,鋼筋混凝土造,0740323,184.72,4,2,3,有,有,有,60000,325,,0.0,0,,RPUQMLTKMHGGFEA68CC
北投區,建物,臺北市北投區中央北路四段577巷21號三樓,0.0,住,,,1100326,土地0建物1車位0,三層,4,公寓(5樓含以下無電梯),住家用,鋼筋混凝土造,0660623,92.96,3,2,1,有,無,有,25000,269,,0.0,0,住宅及都市更新中心108年社會住宅包租代管第二期計畫,RPXQMLTKMHGGFEA98CC
士林區,建物,臺北市士林區社中街２６４巷８號三樓,0.0,住,,,1100407,土地0建物1車位0,三層,5,公寓(5樓含以下無電梯),住家用,鋼筋混凝土造,0700806,117.63,3,2,2,有,無,有,24000,204,,0.0,0,,RPWNMLKLMHGGFEA77CC
士林區,建物,臺北市士林區士東路2巷21號3樓,0.0,住,,,1100331,土地0建物1車位0,三層,10,華廈(10層含以下有電梯),住家用,鋼筋混凝土造,0921106,119.21000000000001,3,2,2,有,有,有,65000,545,,0.0,0,,RPQPMLKLMHGGFEA37CC
士林區,建物,臺北市士林區天母北路4巷5之6號、5之7號1樓,0.0,商,,,1100330,土地0建物1車位0,十二層,6,華廈(10層含以下有電梯),住家用,鋼筋混凝土造,0830811,146.93,2,1,2,有,有,有,83000,565,,0.0,0,,RPRPMLKLMHGGFEA47CC
文山區,建物,臺北市文山區辛亥路4段222巷16號五樓,0.0,住,,,1100311,土地0建物1車位0,五層,5,公寓(5樓含以下無電梯),住家用,鋼筋混凝土造,0690725,96.23,3,2,1,有,無,有,15000,156,,0.0,0,台北市都發局社會住宅包租代管計畫,RPQPMLKLMHGGFAA96CC
文山區,建物,臺北市文山區政大二街９０號,0.0,住,,,1100408,土地0建物1車位1,見其他登記事項,5,華廈(10層含以下有電梯),住家用,鋼筋混凝土造,0980406,281.82,4,2,3,有,有,有,50000,177,坡道平面,33.66,0,含增建或未登記建物。；,RPSPMLKLMHGGFAA17CC
信義區,建物,臺北市信義區松德路159號11樓,0.0,住,,,1100325,土地0建物1車位0,十一層,30,辦公商業大樓,商業用,鋼骨混凝土造,0820524,144.56,3,1,2,有,有,無,60000,415,,0.0,0,,RPPNMLKLMHGGFDA96CC
信義區,車位,臺北市信義區松隆路２９８號等共有部分,0.0,商,,,1100330,土地0建物0車位1,,,其他,,,,38.56,0,0,0,有,有,無,5000,,坡道平面,38.56,5000,,RPSNMLKLMHGGFDA27CC
南港區,建物,臺北市南港區忠孝東路465號,0.0,工,,,1100326,土地0建物1車位0,一層,11,廠辦,工業用,鋼筋混凝土造,0800412,875.2299999999999,0,0,0,無,有,有,372400,425,,0.0,0,送三車位免租金,RPTNMLKLMHGGFDA37CC
南港區,建物,臺北市南港區園區街８號五樓之５,0.0,住,,,1100407,土地0建物1車位1,五層,14,住宅大樓(11層含以上有電梯),住家用,鋼筋混凝土造,0980611,169.13,3,2,2,有,有,有,53000,313,坡道平面,40.08,0,租金含管理費。,RPPOMLKLMHGGFDA07CC
南港區,建物,臺北市南港區惠民街７３號三樓,0.0,住,,,1100409,土地0建物1車位1,三層,9,華廈(10層含以下有電梯),住家用,鋼筋混凝土造,0990714,221.45,4,2,2,有,有,有,80000,361,坡道平面,30.73,0,租金含管理費。,RPSOMLKLMHGGFDA37CC
信義區,建物,臺北市信義區永吉路187巷6弄1之2號二樓,0.0,住,,,1100409,土地0建物1車位0,二層,5,公寓(5樓含以下無電梯),住家用,鋼筋混凝土造,0721104,86.56,3,2,2,有,無,有,28000,323,,0.0,0,,RPUOMLKLMHGGFDA57CC
信義區,建物,臺北市信義區松德路200巷9號2樓,0.0,其他,,,1100327,土地0建物1車位0,二層,15,住宅大樓(11層含以上有電梯),住家用,鋼筋混凝土造,0810507,188.98,4,2,2,有,有,有,68000,360,,0.0,0,,RPOPMLKLMHGGFDA07CC
信義區,建物,臺北市信義區光復南路４７３巷１５號二樓,0.0,住,,,1100408,土地0建物1車位0,二層,8,華廈(10層含以下有電梯),住家用,鋼筋混凝土造,0970328,160.55,4,2,2,有,有,有,55000,343,,0.0,0,,RPPPMLKLMHGGFDA17CC
信義區,建物,臺北市信義區光復南路501號4樓之3,0.0,商,,,1100414,土地0建物1車位0,四層,12,住宅大樓(11層含以上有電梯),見使用執照,鋼筋混凝土造,0710407,60.45,2,1,1,有,有,有,28000,463,,0.0,0,,RPQPMLKLMHGGFDA27CC
信義區,建物,臺北市信義區信義路六段７６巷２弄４０號二樓,0.0,住,,,1100406,土地0建物1車位0,二層,5,公寓(5樓含以下無電梯),住家用,鋼筋混凝土造,0760821,114.78,3,2,2,有,無,有,37000,322,,0.0,0,,RPSPMLKLMHGGFDA47CC
萬華區,建物,臺北市萬華區梧州街68號2樓,0.0,,,,1100419,土地0建物1車位0,二層,4,公寓(5樓含以下無電梯),住家用,鋼筋混凝土造,0611101,68.79,2,1,1,有,無,無,16000,233,,0.0,0,,RPOOMLKLMHGGFBA76CC
萬華區,建物,臺北市萬華區萬大路187巷3弄35號四樓,0.0,商,,,1100406,土地0建物1車位0,四層,5,套房(1房1廳1衛),住家用,鋼筋混凝土造,0640508,31.18,1,1,1,有,無,有,8000,257,,0.0,0,,RPWOMLKLMHGGFBA57CC
中正區,建物,臺北市中正區重慶南路1段83號10樓,0.0,商,,,1100325,土地0建物1車位0,十層,11,辦公商業大樓,,鋼筋混凝土造,0661029,784.34,0,0,0,無,無,無,379610,484,,0.0,0,租金含5%營業稅。,RPRPMLKLMHGGFBA17CC
中正區,建物,臺北市中正區連雲街6巷8號6樓,0.0,住,,,1100417,土地0建物1車位0,六層,8,華廈(10層含以下有電梯),住家用,鋼筋混凝土造,0930917,96.08000000000001,2,1,2,有,有,有,43000,448,,0.0,0,,RPSPMLKLMHGGFBA27CC
內湖區,建物,臺北市內湖區瑞光路582號9樓,0.0,工,,,1100323,土地0建物1車位1,九層,9,廠辦,工業用,鋼筋混凝土造,0880806,245.38,0,0,0,無,有,有,99000,403,坡道平面,19.14,0,,RPTOMLKLMHGGFCA37CC
內湖區,建物,臺北市內湖區康寧路三段１８９巷１５９弄３號四樓,0.0,住,,,1100407,土地0建物0車位0,四層,5,套房(1房1廳1衛),住家用,鋼筋混凝土造,0780127,30.0,1,0,1,有,有,有,9000,300,,0.0,0,租金含管理費。部分承租，公設面積無法分算。,RPPQMLKLMHGGFCA17CC
中山區,建物,臺北市中山區新生北路二段62巷11號14樓之3,0.0,商,,,1100331,土地0建物1車位0,十四層,16,住宅大樓(11層含以上有電梯),住家用,鋼筋混凝土造,1000824,208.43,2,2,2,有,有,有,80000,384,,0.0,0,,RPRQMLKLMHGGFCA37CC
中山區,建物,臺北市中山區林森北路587號4樓,0.0,商,,,1100331,土地0建物1車位0,四層,13,住宅大樓(11層含以上有電梯),住家用,鋼筋混凝土造,1000726,88.98,1,2,1,有,有,有,53000,596,,0.0,0,,RPSQMLKLMHGGFCA47CC
內湖區,建物,臺北市內湖區大湖山莊街２１９巷３４弄３之２號,0.0,住,,,1100408,土地0建物1車位0,一層,6,套房(1房1廳1衛),住家用,鋼筋混凝土造,0810717,38.53,1,1,1,有,有,有,14000,363,,0.0,0,,RPTQMLKLMHGGFCA57CC
中山區,建物,臺北市中山區中山北路二段93巷18號4樓,0.0,商,,,1100331,土地0建物1車位0,四層,12,住宅大樓(11層含以上有電梯),住家用,鋼筋混凝土造,1020111,166.15,3,2,2,有,有,有,73000,439,,0.0,0,,RPQRMLKLMHGGFCA37CC
內湖區,建物,臺北市內湖區金湖路364號1樓,34.1,住,,,1100420,土地0建物1車位0,一層,9,華廈(10層含以下有電梯),商業用,鋼筋混凝土造,0880105,153.02,0,0,0,無,有,有,80000,523,,0.0,0,,RPOTMLKLMHGGFCA37CC
中山區,建物,臺北市中山區林森北路575號10樓之9,0.0,商,,,1100410,土地0建物1車位0,十層,11,住宅大樓(11層含以上有電梯),住家用,鋼筋混凝土造,0660322,145.23,3,2,2,有,有,有,45000,310,,0.0,0,,RPOUMLKLMHGGFCA47CC
內湖區,建物,臺北市內湖區文德路６６巷３２弄２號六樓,0.0,住,,,1100406,土地0建物1車位0,六層,7,華廈(10層含以下有電梯),住家用,鋼筋混凝土造,0730204,126.81,2,2,2,有,有,有,34650,273,,0.0,0,租金含管理費,RPPUMLKLMHGGFCA57CC
中山區,建物,臺北市中山區南京東路二段108號十四樓之25,0.0,商,,,1100326,土地0建物1車位0,十四層,18,住宅大樓(11層含以上有電梯),住家用,見其他登記事項,0990917,66.32,1,1,1,有,有,有,44000,663,,0.0,0,租賃範圍不含車位，且無法區分車位面積。；含管理費、稅金或水電等費用。；,RPPNMLLLMHGGFCA96CC
中山區,建物,臺北市中山區民生東路三段88巷4號4樓之1,0.0,住,,,1100405,土地0建物1車位0,四層,15,住宅大樓(11層含以上有電梯),見其他登記事項,鋼筋混凝土造,0750314,109.42999999999999,3,2,2,有,有,有,40000,366,,0.0,0,附傢俱家電、含管理費,RPVNMLLLMHGGFCA57CC
中山區,建物,臺北市中山區長安東路二段230號6樓之1,0.0,商,,,1100416,土地0建物1車位0,六層,12,辦公商業大樓,商業用,鋼筋混凝土造,0740418,211.07999999999998,0,0,0,無,有,無,70000,332,,0.0,0,含稅費,RPQOMLLLMHGGFCA17CC
中山區,建物,臺北市中山區中山北路一段53巷8號9樓之1,0.0,商,,,1100331,土地0建物1車位0,九層,12,住宅大樓(11層含以上有電梯),住家用,鋼筋混凝土造,0970104,48.83,1,1,1,有,無,有,34000,696,,0.0,0,續租。；,RPROMLLLMHGGFCA27CC
中山區,建物,臺北市中山區堤頂大道二段500號6樓之5,0.0,其他,,,1100304,土地0建物1車位0,六層,10,其他,商業用,鋼筋混凝土造,0991201,84.13,2,1,1,有,有,有,35000,416,,0.0,0,,RPUOMLLLMHGGFCA57CC
中山區,建物,臺北市中山區新生北路二段108號五樓之22,0.0,商,,,1100324,土地0建物1車位0,五層,14,住宅大樓(11層含以上有電梯),商業用,鋼筋混凝土造,0760305,38.08,1,0,1,有,無,有,13300,349,,0.0,0,,RPWPMLLLMHGGFCA87CC
中山區,建物,臺北市中山區民生東路二段147巷6弄23號三樓,0.0,住,,,1100325,土地0建物0車位0,三層,3,套房(1房1廳1衛),,加強磚造,,37.93,1,0,1,有,無,有,15200,401,,0.0,0,此為分租套房，第三層共分成2間，一間平均面積約為37.93平方公尺。,RPXPMLLLMHGGFCA97CC
中山區,建物,臺北市中山區八德路二段229號三樓,0.0,商,,,1100325,土地0建物0車位0,三層,5,套房(1房1廳1衛),住家用,鋼筋混凝土造,0610720,26.17,1,0,1,有,無,有,8000,306,,0.0,0,此為分租套房，第三層共分成4間，一間平均面積約為26.17平方公尺。,RPOQMLLLMHGGFCA17CC
中山區,建物,臺北市中山區新生北路三段35號三樓,0.0,住,,,1100325,土地0建物0車位0,三層,4,套房(1房1廳1衛),住家用,鋼筋混凝土造,0630726,21.49,1,0,1,有,無,有,13000,605,,0.0,0,此為分租套房，第三層共分成5間，一間平均面積約為21.49平方公尺。,RPPQMLLLMHGGFCA27CC
中山區,建物,臺北市中山區樂群三路289號7樓之6,0.0,其他,,,1100305,土地0建物1車位1,七層,10,其他,商業用,鋼筋混凝土造,0981126,172.1,3,2,2,有,無,有,70000,407,坡道平面,19.24,0,,RPRQMLLLMHGGFCA47CC
中山區,建物,臺北市中山區民生東路二段170號11樓,0.0,商,,,1100325,土地0建物1車位0,十一層,12,辦公商業大樓,住家用,鋼筋混凝土造,0700316,326.28000000000003,3,1,0,有,有,有,175000,536,,0.0,0,,RPWQMLLLMHGGFCA97CC
中山區,建物,臺北市中山區德惠街7之2號十一樓,0.0,商,,,1100326,土地0建物1車位0,十一層,12,住宅大樓(11層含以上有電梯),見其他登記事項,鋼筋混凝土造,1091211,107.21000000000001,2,1,2,有,有,有,54000,504,,0.0,0,租賃範圍不含車位，且無法區分車位面積。；含管理費、稅金或水電等費用。；,RPRRMLLLMHGGFCA57CC
中山區,建物,臺北市中山區建國北路二段3巷15號四樓之1,0.0,住,,,1100416,土地0建物1車位0,四層,9,華廈(10層含以下有電梯),商業用,鋼筋混凝土造,0811217,115.63,0,0,0,無,無,有,61440,531,,0.0,0,,RPTRMLLLMHGGFCA77CC
中山區,建物,臺北市中山區敬業一路５０號,0.0,商,,,1100409,土地0建物1車位1,見其他登記事項,8,辦公商業大樓,商業用,鋼筋混凝土造,0961206,162.26,1,1,1,有,有,有,60000,370,坡道機械,20.45,0,,RPURMLLLMHGGFCA87CC
中山區,建物,臺北市中山區南京東路二段１１５巷３弄４號,0.0,住,,,1100409,土地0建物1車位0,一層,3,店面(店鋪),,加強磚造,,70.89,0,1,1,有,無,無,60000,846,,0.0,0,含增建或未登記建物。；,RPXRMLLLMHGGFCA18CC
中山區,建物,臺北市中山區中山北路二段42巷18號5樓之1,0.0,住,,,1100323,土地0建物1車位0,五層,8,套房(1房1廳1衛),住家用,鋼筋混凝土造,1081224,66.08,1,1,1,有,有,有,49000,742,,0.0,0,,RPOSMLLLMHGGFCA37CC
中山區,建物,臺北市中山區南京東路2段108號12樓之10,0.0,其他,,,1100324,土地0建物1車位0,十二層,18,套房(1房1廳1衛),住家用,見其他登記事項,0990917,48.95,1,1,1,有,有,有,33000,674,,0.0,0,,RPQSMLLLMHGGFCA57CC
中山區,建物,臺北市中山區農安街8號十三樓之1,0.0,商,,,1100408,土地0建物1車位0,十三層,14,住宅大樓(11層含以上有電梯),住家用,鋼筋混凝土造,0980622,57.29,1,1,1,有,有,有,40000,698,,0.0,0,續租。；含管理費、稅金或水電等費用。；,RPSSMLLLMHGGFCA77CC
中山區,建物,臺北市中山區中原街46之1號7樓,0.0,住,,,1100305,土地0建物1車位0,七層,7,華廈(10層含以下有電梯),見其他登記事項,鋼筋混凝土造,1070925,62.959999999999994,2,1,2,有,無,有,45000,715,,0.0,0,,RPXSMLLLMHGGFCA28CC
中山區,建物,臺北市中山區中山北路一段83巷32號14樓之2,0.0,商,,,1100305,土地0建物1車位0,十四層,15,住宅大樓(11層含以上有電梯),住家用,鋼筋混凝土造,0970314,142.13,3,2,2,有,無,有,63000,443,,0.0,0,,RPRTMLLLMHGGFCA77CC
中山區,建物,臺北市中山區中山北路三段38號6樓,0.0,商,,,1100305,土地0建物1車位0,六層,13,住宅大樓(11層含以上有電梯),住家用,見其他登記事項,1061020,184.1,2,2,2,有,有,有,90000,489,,0.0,0,,RPTTMLLLMHGGFCA97CC
中山區,建物,臺北市中山區雙城街13巷11號8樓,0.0,商,,,1100329,土地0建物1車位0,八層,15,住宅大樓(11層含以上有電梯),住家用,鋼筋混凝土造,1010327,174.39,3,2,2,有,有,有,60000,344,,0.0,0,含管理費、稅金或水電等費用。；,RPUTMLLLMHGGFCA08CC
中山區,建物,臺北市中山區長安東路166號12樓,0.0,商,,,1100305,土地0建物1車位0,十二層,14,套房(1房1廳1衛),住家用,見其他登記事項,1050411,93.57,1,1,1,有,有,有,57000,609,,0.0,0,,RPWTMLLLMHGGFCA28CC
中山區,建物,臺北市中山區合江街83巷10號1樓,0.0,住,,,1100421,土地0建物1車位0,一層,4,公寓(5樓含以下無電梯),住家用,鋼筋混凝土造,0650721,98.13,3,2,1,有,無,有,40000,408,,0.0,0,含稅金或水電等費用。,RPRUMLLLMHGGFCA87CC
大同區,建物,臺北市大同區萬全街1號四樓之7,0.0,商,,,1100325,土地0建物1車位0,四層,15,住宅大樓(11層含以上有電梯),住家用,鋼筋混凝土造,1041016,84.48,1,1,1,有,有,有,66500,787,,0.0,0,租賃範圍不含車位，且無法區分車位面積。；續租。；含管理費、稅金或水電等費用。；,RPPNMLLLMHGGFBA86CC
萬華區,建物,臺北市萬華區武昌街二段26號,0.0,商,,,1100331,土地0建物1車位0,一層,4,店面(店鋪),,加強磚造,,63.22,0,0,0,無,無,無,80000,1265,,0.0,0,續租。；,RPTNMLLLMHGGFBA27CC
萬華區,建物,臺北市萬華區武昌街二段30號,0.0,商,,,1100409,土地0建物1車位0,一層,2,店面(店鋪),工業用,加強磚造,,37.51,0,0,0,無,無,無,88000,2346,,0.0,0,,RPUNMLLLMHGGFBA37CC
大同區,建物,臺北市大同區重慶北路三段261號,0.0,住,,,1100330,土地0建物0車位0,全,4,透天厝,,加強磚造,,41.67,2,1,1,有,無,有,18900,454,,0.0,0,第四層共分成2間，一間平均面積約為41.67平方公尺。,RPWNMLLLMHGGFBA57CC
萬華區,建物,臺北市萬華區西寧南路269號1樓,0.0,商,,,1100415,土地0建物1車位0,一層,13,店面(店鋪),見其他登記事項,鋼筋混凝土造,1080222,48.71,0,0,0,無,無,無,29000,595,,0.0,0,,RPPOMLLLMHGGFBA96CC
大同區,建物,臺北市大同區市民大道一段201號五樓之7,0.0,其他,,,1100329,土地0建物1車位1,五層,18,住宅大樓(11層含以上有電梯),住家用,見其他登記事項,0980724,133.54,2,1,2,有,有,有,73500,550,坡道平面,0.0,0,租賃範圍不含車位，且無法區分車位面積。；續租。；含管理費、稅金或水電等費用。；,RPQOMLLLMHGGFBA07CC
大同區,房地(土地+建物),臺北市大同區延平北路二段247巷21號,7.2,商,,,1100413,土地1建物1車位0,一層,7,套房(1房1廳1衛),見其他登記事項,鋼筋混凝土造,0961212,55.4,0,0,1,有,有,無,27000,487,,0.0,0,,RPTOMLLLMHGGFBA37CC
大同區,建物,臺北市大同區市民大道一段211號10樓之11,0.0,其他,,,1100324,土地0建物1車位0,十層,18,套房(1房1廳1衛),見其他登記事項,見其他登記事項,0980724,51.019999999999996,1,1,1,有,有,有,35000,686,,0.0,0,,RPXOMLLLMHGGFBA77CC
大同區,建物,臺北市大同區市民大道一段211號11樓之11,0.0,其他,,,1100324,土地0建物1車位0,十一層,18,套房(1房1廳1衛),見其他登記事項,見其他登記事項,0980724,51.019999999999996,1,1,1,有,有,有,35000,686,,0.0,0,,RPOPMLLLMHGGFBA96CC
萬華區,建物,臺北市萬華區漢口街二段41之2號,0.0,商,,,1100330,土地0建物0車位0,二層,4,套房(1房1廳1衛),,加強磚造,,22.12,1,0,1,有,無,有,8000,362,,0.0,0,此為分租套房，第2層共分成7間，一間平均面積約為22.12平方公尺。,RPPPMLLLMHGGFBA07CC
松山區,建物,臺北市松山區南京東路四段23號9樓,0.0,商,,,1100416,土地0建物1車位0,五層,15,套房(1房1廳1衛),住家用,鋼筋混凝土造,0971205,55.89,1,1,1,有,無,有,35000,626,,0.0,0,,RPTNMLLLMHGGFDA47CC
松山區,建物,臺北市松山區復興北路179號7樓之2,0.0,商,,,1100409,土地0建物1車位0,七層,12,住宅大樓(11層含以上有電梯),住家用,鋼筋混凝土造,,57.14,1,1,1,有,有,無,30000,525,,0.0,0,,RPVNMLLLMHGGFDA67CC
松山區,建物,臺北市松山區復興北路179號9樓之13,0.0,商,,,1100414,土地0建物1車位0,九層,12,住宅大樓(11層含以上有電梯),住家用,鋼筋混凝土造,,42.21,1,1,1,有,有,無,19800,469,,0.0,0,,RPXNMLLLMHGGFDA87CC
松山區,建物,臺北市松山區八德路四段687號5樓,0.0,商,,,1100316,土地0建物1車位0,五層,12,套房(1房1廳1衛),商業用,鋼筋混凝土造,0730810,23.68,1,1,1,有,有,有,12000,507,,0.0,0,租金含管理費，無車位,RPOOMLLLMHGGFDA07CC
松山區,建物,臺北市松山區八德路三段155巷4弄19號3樓A室,0.0,住,,,1100313,土地0建物1車位0,三層,4,公寓(5樓含以下無電梯),住家用,鋼筋混凝土造,,95.42,2,2,1,有,無,有,29000,304,,0.0,0,,RPQOMLLLMHGGFDA27CC
信義區,房地(土地+建物),臺北市信義區松山路604號,42.87,住,,,1100416,土地6建物1車位0,一層,4,公寓(5樓含以下無電梯),住家用,鋼筋混凝土造,0630522,129.31,0,2,1,有,無,無,68000,526,,0.0,0,,RPVOMLLLMHGGFDA77CC
南港區,建物,臺北市南港區向陽路２５８巷５號六樓,0.0,住,,,1100409,土地0建物1車位1,六層,15,住宅大樓(11層含以上有電梯),住家用,鋼筋混凝土造,0950803,126.24000000000001,2,2,1,有,有,有,35000,277,坡道平面,37.84,0,含機車車位。,RPWOMLLLMHGGFDA87CC
信義區,建物,臺北市信義區信義路五段127號3樓之16,0.0,其他,,,1100411,土地0建物1車位0,三層,19,住宅大樓(11層含以上有電梯),住家用,見其他登記事項,0951229,67.17,0,0,0,無,有,有,30000,447,,0.0,0,,RPOPMLLLMHGGFDA17CC
南港區,建物,臺北市南港區忠孝東路六段484號五樓,0.0,住,,,1100329,土地0建物0車位0,五層,5,套房(1房1廳1衛),住家用,鋼筋混凝土造,0721222,17.02,1,0,1,有,無,有,10000,588,,0.0,0,此為分租套房，第5層共分成6間，一間平均面積約為17.02平方公尺。,RPQPMLLLMHGGFDA37CC
信義區,建物,臺北市信義區吳興街600巷100弄51號5樓,0.0,住,,,1100421,土地0建物1車位0,五層,5,公寓(5樓含以下無電梯),住家用,鋼筋混凝土造,0720905,89.38,3,2,1,有,無,無,22000,246,,0.0,0,,RPRPMLLLMHGGFDA47CC
南港區,建物,臺北市南港區研究院路二段２巷５４弄７號二樓,0.0,住,,,1100407,土地0建物1車位0,二層,5,公寓(5樓含以下無電梯),住家用,鋼筋混凝土造,0750225,108.05,3,2,2,有,無,有,30000,278,,0.0,0,,RPSPMLLLMHGGFDA57CC
信義區,建物,臺北市信義區虎林街１０４巷１０９號,0.0,住,,,1100409,土地0建物0車位0,全,3,透天厝,見其他登記事項,鋼筋混凝土造,0800818,25.0,0,1,1,有,無,有,22000,880,,0.0,0,租賃期間含免租金裝潢期。部分承租。,RPVPMLLLMHGGFDA87CC
文山區,建物,臺北市文山區景華街67號四樓,0.0,住,,,1100404,土地0建物1車位0,四層,4,公寓(5樓含以下無電梯),見其他登記事項,鋼筋混凝土造,0640305,101.77,3,2,3,有,無,無,26000,255,,0.0,0,附部分家電,RPQNMLLLMHGGFAA86CC
中正區,建物,臺北市中正區辛亥路一段8號,0.0,住,,,1100302,土地0建物1車位0,一層,15,店面(店鋪),見其他登記事項,鋼筋混凝土造,1070717,58.5,0,0,0,無,無,有,45000,769,,0.0,0,,RPOPMLLLMHGGFAA86CC
文山區,建物,臺北市文山區景興路２８２巷１號十樓之２,0.0,商,,,1100327,土地0建物1車位0,十層,15,住宅大樓(11層含以上有電梯),住家用,鋼筋混凝土造,0810103,117.26,3,2,2,有,有,有,33000,281,,0.0,0,,RPSPMLLLMHGGFAA27CC
大安區,建物,臺北市大安區敦化南路二段63巷65號3樓之1,0.0,住,,,1100415,土地0建物1車位1,三層,17,住宅大樓(11層含以上有電梯),住家用,鋼筋混凝土造,0741218,194.72,5,2,2,有,有,有,65000,334,坡道平面,0.0,0,,RPQNMLLLMHGGFFA37CC
大安區,建物,臺北市大安區忠孝東路四段170巷23號五樓,0.0,住,,,1100325,土地0建物0車位0,五層,5,套房(1房1廳1衛),住家用,鋼筋混凝土造,,33.56,1,0,1,有,無,有,15000,447,,0.0,0,此為分租套房，第5層共分成3間，一間平均面積約為33.56平方公尺。,RPQOMLLLMHGGFFA47CC
大安區,建物,臺北市大安區忠孝東路三段１９９之１號,0.0,商,,,1100323,土地0建物1車位0,一層,6,店面(店鋪),商業用,鋼筋混凝土造,0610308,80.18,0,0,0,無,有,有,91023,1135,,0.0,0,,RPVOMLLLMHGGFFA97CC
士林區,建物,臺北市士林區天母東路59號三樓,0.0,商,,,1100325,土地0建物1車位1,三層,7,華廈(10層含以下有電梯),住家用,鋼筋混凝土造,0750902,244.53,4,2,2,有,有,有,91000,372,坡道平面,0.0,0,租賃範圍不含車位，且無法區分車位面積。；含管理費、稅金或水電等費用。；,RPPNMLLLMHGGFEA17CC
北投區,建物,臺北市北投區裕民六路123號七樓,0.0,商,,,1100326,土地0建物1車位0,七層,14,住宅大樓(11層含以上有電梯),住家用,鋼筋混凝土造,1040305,204.39,3,2,2,有,有,有,88000,431,,0.0,0,租賃範圍不含車位，且無法區分車位面積。；含管理費、稅金或水電等費用。；,RPSNMLLLMHGGFEA47CC
士林區,建物,臺北市士林區天母東路43巷4弄10號六樓,0.0,商,,,1100416,土地0建物1車位0,六層,7,華廈(10層含以下有電梯),住家用,鋼筋混凝土造,0910125,184.55,3,2,2,有,有,有,85000,461,,0.0,0,續租。；含管理費、稅金或水電等費用。；,RPTPMLLLMHGGFEA77CC
士林區,建物,臺北市士林區天母東路43巷4弄12之1號2樓,0.0,商,,,1100401,土地0建物1車位1,二層,6,華廈(10層含以下有電梯),住家用,鋼筋混凝土造,0850605,178.5,3,2,2,有,有,有,60000,336,坡道平面,0.0,5000,含管理費、稅金或水電等費用。；,RPSNMLMLMHGGFEA57CC
士林區,建物,臺北市士林區忠誠路二段42之1號4樓,0.0,住,,,1100401,土地0建物1車位0,四層,17,住宅大樓(11層含以上有電梯),住家用,鋼筋混凝土造,0761116,178.07999999999998,4,2,2,有,有,有,65000,365,,0.0,0,,RPTNMLMLMHGGFEA67CC
士林區,建物,臺北市士林區中山北路六段157巷11號12樓之3,0.0,工,,,1100401,土地0建物1車位1,十二層,15,其他,見其他登記事項,鋼筋混凝土造,0971002,143.66,2,2,1,有,有,有,63000,439,坡道平面,42.51,0,續租。；含管理費、稅金或水電等費用。；,RPUNMLMLMHGGFEA77CC
北投區,建物,臺北市北投區文林北路302號5樓之1,0.0,住,,,1100401,土地0建物1車位0,五層,23,住宅大樓(11層含以上有電梯),住家用,鋼骨鋼筋混凝土造,1040213,169.4,3,2,2,有,有,有,67800,400,,0.0,0,,RPWNMLMLMHGGFEA97CC
士林區,建物,臺北市士林區士東路266巷16弄6號四樓,0.0,住,,,1100419,土地0建物1車位0,四層,5,公寓(5樓含以下無電梯),住家用,鋼筋混凝土造,0730912,115.11,3,2,2,有,有,有,26000,226,,0.0,0,,RPROMLMLMHGGFEA57CC
北投區,建物,臺北市北投區裕民二路79號8樓,0.0,商,,,1100401,土地0建物1車位0,八層,19,住宅大樓(11層含以上有電梯),見其他登記事項,鋼筋混凝土造,1021108,108.93,2,2,1,有,有,有,65000,597,,0.0,0,續租。；含管理費、稅金或水電等費用。；,RPXOMLMLMHGGFEA18CC
