中山區,建物,臺北市中山區新生北路1段100號7樓,0.0,商,,,1100315,土地0建物1車位0,七層,12,住宅大樓(11層含以上有電梯),住家用,鋼筋混凝土造,0761217,139.72,3,2,2,有,有,有,55000,394,,0.0,0,續租。；含管理費、稅金或水電等費用。；,RPRPMLKMLHGGFCA27CC
內湖區,建物,臺北市內湖區內湖路三段60巷27號5樓,0.0,住,,,1100312,土地0建物1車位1,五層,19,住宅大樓(11層含以上有電梯),住家用,鋼筋混凝土造,1060407,230.93,3,2,2,有,無,有,70000,303,坡道平面,28.98,0,,RPSPMLKMLHGGFCA37CC
中山區,建物,臺北市中山區基湖路135號2樓,0.0,住,,,1100315,土地0建物1車位1,二層,7,華廈(10層含以下有電梯),住家用,鋼筋混凝土造,0981201,236.15,3,2,2,有,無,有,100000,423,坡道機械,20.8,0,,RPRQMLKMLHGGFCA37CC
中山區,建物,臺北市中山區農安街6號10樓之12,0.0,商,,,1100319,土地0建物1車位0,十層,14,住宅大樓(11層含以上有電梯),商業用,鋼筋混凝土造,0980622,53.7,1,1,1,有,無,有,26000,484,,0.0,0,,RPSQMLKMLHGGFCA47CC
中山區,建物,臺北市中山區民生東路三段29號6樓,0.0,商,,,1100301,土地0建物1車位0,六層,12,住宅大樓(11層含以上有電梯),住家用,鋼筋混凝土造,0690920,136.46,0,0,0,無,無,無,45000,330,,0.0,0,,RPUQMLKMLHGGFCA67CC
中山區,建物,臺北市中山區松江路170巷9號2樓之1,0.0,住,,,1100309,土地0建物1車位0,二層,11,住宅大樓(11層含以上有電梯),見其他登記事項,鋼筋混凝土造,1060927,134.68,2,1,2,有,無,有,75492,561,,0.0,0,,RPXQMLKMLHGGFCA97CC
北投區,建物,臺北市北投區中和街493巷6號五樓,0.0,住,,,1100312,土地0建物0車位0,五層,5,套房(1房1廳1衛),住家用,鋼筋混凝土造,0711227,21.98,1,0,1,有,無,有,6100,278,,0.0,0,此為分租套房，第五層共分成4間，一間平均面積約為21.98平方公尺。,RPSNMLKMLHGGFEA37CC
士林區,建物,臺北市士林區劍潭路３８號,0.0,其他,,,1100313,土地0建物1車位0,一層,5,店面(店鋪),商業用,鋼筋混凝土造,0700826,329.70000000000005,0,2,1,有,無,無,102168,310,,0.0,0,含增建或未登記建物。；租金含稅。租期內含免租裝潢期。,RPTNMLKMLHGGFEA47CC
士林區,建物,臺北市士林區德行東路３３１巷５０弄６號,0.0,住,,,1100313,土地0建物1車位0,一層,5,店面(店鋪),商業用,鋼筋混凝土造,0681128,123.33,2,2,1,有,無,無,30000,243,,0.0,0,租金含稅。租期內含免租裝潢期。,RPOOMLKMLHGGFEA07CC
北投區,建物,臺北市北投區三合街一段75號2樓,0.0,住,,,1100312,土地0建物1車位1,二層,9,華廈(10層含以下有電梯),住家用,鋼筋混凝土造,1031119,293.4,3,2,2,有,無,有,103000,351,坡道平面,40.49,0,,RPPOMLKMLHGGFEA17CC
士林區,房地(土地+建物),臺北市士林區天母西路48之7號,16.85,商,,,1100217,土地4建物1車位0,一層,7,華廈(10層含以下有電梯),住家用,鋼筋混凝土造,0690606,85.24000000000001,2,2,1,有,有,無,24000,282,,0.0,0,,RPUOMLKMLHGGFEA67CC
士林區,建物,臺北市士林區中山北路六段４５０巷３０號四樓,0.0,住,,,1100315,土地0建物1車位0,四層,4,公寓(5樓含以下無電梯),住家用,鋼筋混凝土造,0651209,142.78,4,2,2,有,無,有,39000,273,,0.0,0,,RPXOMLKMLHGGFEA97CC
大安區,建物,臺北市大安區信義路三段61號10樓,0.0,其他,,,1100319,土地0建物1車位2,十層,29,住宅大樓(11層含以上有電梯),住家用,見其他登記事項,0991025,705.06,4,3,4,有,有,有,416000,590,坡道平面,92.52,0,,RPPPMLKMLHGGFFA37CC
大安區,房地(土地+建物),臺北市大安區敦化南路二段182號11樓之1,11.87,其他,,,1100316,土地1建物1車位0,十一層,21,住宅大樓(11層含以上有電梯),住家用,鋼筋混凝土造,0781014,187.77,3,2,3,有,無,無,70000,373,,0.0,0,,RPSPMLKMLHGGFFA67CC
大安區,建物,臺北市大安區和平東路一段5樓-1、5樓-10,0.0,商,,,1100310,土地0建物1車位0,五層,11,辦公商業大樓,住家用,鋼筋混凝土造,,157.85000000000002,0,0,0,無,無,有,40000,253,,0.0,0,,RPUPMLKMLHGGFFA87CC
大安區,建物,臺北市大安區大安路二段８８號,0.0,住,,,1100305,土地0建物1車位0,一層,7,店面(店鋪),商業用,鋼筋混凝土造,0730814,76.11,0,0,0,無,有,無,75000,985,,0.0,0,,RPPQMLKMLHGGFFA47CC
大安區,建物,臺北市大安區仁愛路四段77號4樓之1,0.0,其他,,,1100317,土地0建物1車位0,四層,14,住宅大樓(11層含以上有電梯),住家用,鋼筋混凝土造,,101.22,3,2,2,有,無,有,38000,375,,0.0,0,,RPQQMLKMLHGGFFA57CC
大安區,建物,臺北市大安區安和路一段37號6樓,0.0,住,,,1100319,土地0建物1車位0,六層,12,住宅大樓(11層含以上有電梯),住家用,鋼筋混凝土造,,139.74,3,2,2,有,無,有,51000,365,,0.0,0,,RPRQMLKMLHGGFFA67CC
大安區,建物,臺北市大安區忠孝東路四段300號6樓,0.0,商,,,1100305,土地0建物1車位0,六層,11,辦公商業大樓,商業用,鋼筋混凝土造,0611228,324.0,0,0,0,無,無,無,176400,544,,0.0,0,,RPTQMLKMLHGGFFA87CC
大安區,建物,臺北市大安區信義路四段１號六樓之１,0.0,商,,,1100225,土地0建物0車位0,六層,12,辦公商業大樓,住家用,鋼筋混凝土造,0611205,111.1,0,1,2,有,有,有,48925,440,,0.0,0,含增建或未登記建物。；部分承租。,RPUNMLLMLHGGFFA77CC
大安區,建物,臺北市大安區光復南路296號8樓之3,0.0,住,,,1100330,土地0建物1車位0,八層,12,住宅大樓(11層含以上有電梯),住家用,鋼筋混凝土造,,98.77,2,2,2,有,有,有,45000,456,,0.0,0,租金不含管理費 無車位,RPVOMLLMLHGGFFA97CC
中正區,建物,臺北市中正區羅斯福路四段６８號十樓之８,0.0,商,,,1100317,土地0建物1車位0,十層,15,套房(1房1廳1衛),見其他登記事項,鋼筋混凝土造,0941229,37.83,1,1,1,有,有,有,25000,661,,0.0,0,含增建或未登記建物。；租金含管理費。,RPXOMLLMLHGGFAA67CC
士林區,建物,臺北市士林區中山北路六段２９３號,0.0,住,,,1100315,土地0建物1車位0,全,3,透天厝,商業用,鋼筋混凝土造,0730321,111.3,0,1,1,有,無,無,40000,359,,0.0,0,含增建或未登記建物。；,RPPNMLLMLHGGFEA17CC
北投區,房地(土地+建物),臺北市北投區裕民六路128號三樓,47.29,商,,,1100222,土地1建物1車位0,三層,10,華廈(10層含以下有電梯),商業用,鋼筋混凝土造,0860225,49.58,1,1,1,有,有,有,18000,363,,0.0,0,此為分租套房.面積為共五間套房.只承租一間.,RPQNMLLMLHGGFEA27CC
士林區,建物,臺北市士林區天母東路４５之１號,0.0,商,,,1100315,土地0建物2車位0,見其他登記事項,7,店面(店鋪),見使用執照,鋼筋混凝土造,0761105,439.56,0,2,0,有,無,無,140000,319,,0.0,0,租賃期間含免租金裝潢期。租金調漲：租期第4年起調漲5%。,RPOOMLLMLHGGFEA17CC
北投區,建物,臺北市北投區石牌路二段357巷3號7樓,0.0,住,,,1100318,土地0建物1車位1,七層,13,住宅大樓(11層含以上有電梯),住家用,鋼筋混凝土造,0981224,316.76,4,2,2,有,有,有,129500,409,坡道平面,0.0,0,,RPVOMLLMLHGGFEA87CC
士林區,建物,臺北市士林區德行東路190巷30弄10號8樓,0.0,住,,,1100310,土地0建物1車位1,見其他登記事項,12,住宅大樓(11層含以上有電梯),住家用,鋼筋混凝土造,0790216,272.91,5,3,3,有,有,有,97000,355,坡道平面,0.0,0,,RPQPMLLMLHGGFEA47CC
中山區,建物,臺北市中山區北安路８４１巷１２號三樓,0.0,住,,,1100312,土地0建物1車位0,三層,5,公寓(5樓含以下無電梯),住家用,鋼筋混凝土造,0731231,83.39,2,2,1,有,無,有,27000,324,,0.0,0,,RPRNMLLMLHGGFCA17CC
中山區,車位,臺北市中山區中山北路二段４４巷２５號地下一層,0.0,商,,,1100312,土地0建物0車位1,,14,其他,停車空間,鋼筋混凝土造,0971124,30.11,0,0,0,有,有,無,5000,,坡道平面,30.1,5000,,RPVNMLLMLHGGFCA57CC
內湖區,建物,臺北市內湖區大湖街１３１巷２弄２號六樓之１,0.0,商,,,1100312,土地0建物1車位0,六層,12,住宅大樓(11層含以上有電梯),住家用,鋼筋混凝土造,0851231,98.02,3,2,2,有,有,有,30000,306,,0.0,0,,RPWNMLLMLHGGFCA67CC
中山區,建物,臺北市中山區中山北路一段27號八樓之1,0.0,商,,,1100315,土地0建物1車位0,八層,16,辦公商業大樓,商業用,鋼骨混凝土造,0851017,314.44,4,0,0,有,有,無,170000,541,,0.0,0,,RPQOMLLMLHGGFCA17CC
中山區,建物,臺北市中山區新生北路二段36號10樓,0.0,商,,,1100330,土地0建物1車位0,十層,17,住宅大樓(11層含以上有電梯),住家用,鋼筋混凝土造,0850718,80.71,2,2,1,有,有,有,23000,285,,0.0,0,,RPTOMLLMLHGGFCA47CC
中山區,建物,臺北市中山區四平街45-6號6樓,0.0,住,,,1100330,土地0建物1車位0,六層,7,華廈(10層含以下有電梯),住家用,鋼筋混凝土造,0610514,114.13,3,2,2,有,無,有,45000,394,,0.0,0,含管理費、稅金或水電等費用。；,RPUPMLLMLHGGFCA67CC
中山區,車位,臺北市中山區中山北路二段４４巷２５號地下一層,0.0,商,,,1100317,土地0建物0車位1,,14,其他,停車空間,鋼筋混凝土造,0971124,30.11,0,0,0,有,有,無,5000,,坡道平面,30.1,5000,,RPXPMLLMLHGGFCA97CC
內湖區,建物,臺北市內湖區內湖路二段265號10樓之5,0.0,商,,,1100327,土地0建物1車位0,十層,13,住宅大樓(11層含以上有電梯),住家用,鋼筋混凝土造,1050601,83.25999999999999,1,1,1,有,無,有,43481,522,,0.0,0,含管理費、稅金或水電等費用。；,RPSQMLLMLHGGFCA57CC
中山區,建物,臺北市中山區民生東路2段1號4樓之2,0.0,商,,,1100315,土地0建物1車位0,四層,14,住宅大樓(11層含以上有電梯),見其他登記事項,鋼筋混凝土造,1021112,202.96,4,2,2,有,有,有,102000,503,,0.0,0,續租。；含管理費、稅金或水電等費用。；,RPWQMLLMLHGGFCA97CC
內湖區,建物,臺北市內湖區瑞光路258巷51號5樓,0.0,工,,,1100303,土地0建物1車位1,五層,8,辦公商業大樓,見其他登記事項,鋼筋混凝土造,1020815,1054.79,5,0,0,有,有,無,300000,284,坡道平面,36.35,0,,RPORMLLMLHGGFCA27CC
中山區,建物,臺北市中山區林森北路587號10樓之2,0.0,商,,,1100315,土地0建物1車位0,十層,13,住宅大樓(11層含以上有電梯),住家用,鋼筋混凝土造,1000726,89.73,2,1,1,有,有,有,54000,602,,0.0,0,含管理費、稅金或水電等費用。；,RPPRMLLMLHGGFCA37CC
內湖區,建物,臺北市內湖區內湖路二段103巷42號六樓,0.0,住,,,1100301,土地0建物1車位0,六層,7,華廈(10層含以下有電梯),住家用,鋼筋混凝土造,0720912,125.45,3,2,2,有,有,有,32000,255,,0.0,0,,RPSRMLLMLHGGFCA67CC
中山區,房地(土地+建物),臺北市中山區建國北路一段71號2樓,21.46,住,,,1100318,土地1建物1車位0,二層,12,辦公商業大樓,商業用,鋼筋混凝土造,0731231,154.08,2,2,2,有,有,無,50000,325,,0.0,0,,RPVRMLLMLHGGFCA97CC
中山區,建物,臺北市中山區松江路２５９巷３１號,0.0,住,,,1100312,土地0建物0車位0,一層,7,店面(店鋪),商業用,鋼筋混凝土造,0730611,49.59,0,1,1,有,有,有,33000,665,,0.0,0,含增建或未登記建物。；部分承租。本租賃標的未計入共有部分之分算面積。租賃期間含免租金裝潢期。,RPXRMLLMLHGGFCA18CC
南港區,房地(土地+建物),臺北市南港區南港路二段290號,34.47,住,,,1100322,土地1建物1車位0,一層,5,公寓(5樓含以下無電梯),住商用,鋼筋混凝土造,0700130,123.62,0,0,0,無,無,無,35000,283,,0.0,0,,RPPNMLLMLHGGFDA07CC
松山區,建物,臺北市松山區民生東路三段113巷7弄15號,0.0,住,,,1100317,土地0建物1車位0,見其他登記事項,7,華廈(10層含以下有電梯),住家用,鋼筋混凝土造,0680125,334.2,0,0,0,無,有,無,136534,409,,0.0,0,,RPQOMLLMLHGGFDA27CC
松山區,建物,臺北市松山區南京東路三段259號9樓,0.0,商,,,1100305,土地0建物1車位0,九層,12,辦公商業大樓,商業用,鋼筋混凝土造,0720210,321.62,0,0,0,無,有,無,200000,622,,0.0,0,,RPSOMLLMLHGGFDA47CC
松山區,建物,臺北市松山區塔悠路３２３號二樓之9,0.0,住,,,1100317,土地0建物1車位0,二層,4,套房(1房1廳1衛),住家用,鋼筋混凝土造,0821021,47.08,1,1,1,有,有,有,18000,382,,0.0,0,,RPTOMLLMLHGGFDA57CC
信義區,建物,臺北市信義區逸仙路42巷17號1樓,0.0,住,,,1100301,土地0建物1車位0,一層,5,公寓(5樓含以下無電梯),住家用,鋼筋混凝土造,,103.67,0,1,1,有,無,有,70000,675,,0.0,0,,RPVOMLLMLHGGFDA77CC
信義區,建物,臺北市信義區基隆路一段176號11樓之1,0.0,住,,,1100324,土地0建物1車位0,十一層,16,辦公商業大樓,見使用執照,鋼筋混凝土造,0810125,661.88,0,0,0,無,有,無,360396,545,,0.0,0,,RPWOMLLMLHGGFDA87CC
信義區,建物,臺北市信義區莊敬路369號,0.0,商,,,1100319,土地0建物1車位0,一層,7,店面(店鋪),商業用,鋼筋混凝土造,0750331,95.46000000000001,0,0,0,無,無,無,47000,492,,0.0,0,,RPXOMLLMLHGGFDA97CC
信義區,建物,臺北市信義區基隆路一段200號6樓,0.0,住,,,1100325,土地0建物0車位0,六層,24,辦公商業大樓,商業用,鋼骨混凝土造,0811015,381.72,0,0,0,無,有,無,333477,874,,0.0,0,分割出租,RPOPMLLMLHGGFDA17CC
南港區,建物,臺北市南港區重陽路194號、196號9樓,0.0,其他,,,1100331,土地0建物1車位2,九層,12,辦公商業大樓,見其他登記事項,鋼筋混凝土造,0950621,826.9200000000001,1,0,0,有,有,無,165000,200,坡道平面,0.0,0,,RPRPMLLMLHGGFDA47CC
南港區,建物,臺北市南港區重陽路198號9樓,0.0,其他,,,1100331,土地0建物1車位0,九層,12,辦公商業大樓,見其他登記事項,鋼筋混凝土造,0950621,412.09000000000003,0,0,0,無,有,無,82000,199,,0.0,0,,RPSPMLLMLHGGFDA57CC
松山區,建物,臺北市松山區八德路四段135號五樓,0.0,住,,,1100310,土地0建物1車位0,五層,7,辦公商業大樓,商業用,鋼筋混凝土造,0810131,292.96,6,0,0,有,有,無,100000,341,,0.0,0,,RPTPMLLMLHGGFDA67CC
中正區,建物,臺北市中正區延平南路6號,0.0,商,,,1100319,土地0建物2車位2,見其他登記事項,5,辦公商業大樓,住商用,鋼筋混凝土造,0601103,766.24,5,5,5,有,無,無,315000,411,一樓平面,0.0,0,,RPRNMLLMLHGGFBA07CC
中正區,建物,臺北市中正區延平南路8號,0.0,商,,,1100319,土地0建物1車位0,見其他登記事項,5,辦公商業大樓,住商用,鋼筋混凝土造,0601103,409.52,5,5,5,有,無,無,157500,385,,0.0,0,,RPTNMLLMLHGGFBA27CC
萬華區,建物,臺北市萬華區和平西路三段65號,0.0,商,,,1100218,土地0建物1車位0,一層,4,店面(店鋪),商業用,加強磚造,0590604,42.54,2,1,1,有,無,無,24000,564,,0.0,0,,RPVNMLLMLHGGFBA47CC
萬華區,建物,臺北市萬華區西寧南路108號5樓之2,0.0,商,,,1100316,土地0建物1車位0,五層,13,住宅大樓(11層含以上有電梯),住家用,鋼筋混凝土造,1000513,104.0,2,1,1,有,無,有,35000,337,,0.0,0,含管理費、稅金或水電等費用。；,RPWPMLLMLHGGFBA77CC
大同區,建物,臺北市大同區太原路80號12樓,0.0,商,,,1100304,土地0建物1車位0,十二層,14,住宅大樓(11層含以上有電梯),住家用,鋼筋混凝土造,0971211,138.42000000000002,3,2,1,有,有,有,55000,397,,0.0,0,,RPXPMLLMLHGGFBA87CC
大同區,建物,臺北市大同區錦西街38巷38號3樓之1,0.0,商,,,1100320,土地0建物1車位0,三層,12,住宅大樓(11層含以上有電梯),商業用,鋼筋混凝土造,0890428,111.81,0,0,0,無,無,有,40000,358,,0.0,0,,RPSNMLLJMHGGFBA96CC
中正區,建物,臺北市中正區仁愛路一段４９號七樓,0.0,住,,,1100316,土地0建物1車位1,七層,16,住宅大樓(11層含以上有電梯),住家用,鋼筋混凝土造,0870724,213.84000000000003,4,2,2,有,有,有,57000,267,坡道平面,0.0,0,,RPUNMLLJMHGGFBA17CC
大同區,建物,臺北市大同區重慶北路三段１１３巷５９號,0.0,住,,,1100318,土地0建物1車位0,一層,7,店面(店鋪),商業用,鋼筋混凝土造,0790507,250.79000000000002,1,1,0,有,有,無,110000,439,,0.0,0,,RPVNMLLJMHGGFBA27CC
萬華區,建物,臺北市萬華區桂林路210號4樓,0.0,住,,,1100315,土地0建物1車位0,四層,5,套房(1房1廳1衛),住家用,鋼筋混凝土造,0720929,47.37,1,1,1,有,無,有,14000,296,,0.0,0,,RPOOMLLJMHGGFBA66CC
萬華區,房地(土地+建物),臺北市萬華區昆明街201巷18號2樓,99.0,商,,,1100308,土地2建物1車位0,二層,4,公寓(5樓含以下無電梯),商業用,鋼筋混凝土造,0681019,69.92,2,1,1,有,無,有,23000,329,,0.0,0,,RPWOMLLJMHGGFBA47CC
大同區,建物,臺北市大同區迪化街二段23巷11號二樓,0.0,住,,,1100309,土地0建物1車位0,二層,4,公寓(5樓含以下無電梯),住家用,鋼筋混凝土造,0660119,56.02,2,1,1,有,無,有,15000,268,,0.0,0,住宅及都市更新中心108年社會住宅包租代管第二期計畫,RPOPMLLJMHGGFBA76CC
信義區,建物,臺北市信義區忠孝東路五段410號17樓之2,0.0,商,,,1100331,土地0建物1車位0,十七層,18,辦公商業大樓,見使用執照,鋼筋混凝土造,0860121,79.03999999999999,1,1,1,有,無,有,32000,405,,0.0,0,,RPOOMLLJMHGGFDA86CC
信義區,建物,臺北市信義區吳興街345號,0.0,住,,,1100401,土地0建物1車位0,一層,4,店面(店鋪),商業用,鋼筋混凝土造,0680801,113.23,0,0,0,無,無,無,50000,442,,0.0,0,續租。；,RPSOMLLJMHGGFDA27CC
信義區,建物,臺北市信義區忠孝東路五段101號4樓,0.0,住,,,1100325,土地0建物1車位0,四層,13,住宅大樓(11層含以上有電梯),見其他登記事項,鋼筋混凝土造,1030829,101.41,2,2,1,有,有,有,80000,789,,0.0,0,續租。；,RPWPMLLJMHGGFDA77CC
松山區,建物,臺北市松山區三民路43巷19號4樓之2,0.0,住,,,1100331,土地0建物1車位0,四層,12,住宅大樓(11層含以上有電梯),住家用,鋼筋混凝土造,0931020,244.77999999999997,3,2,2,有,有,有,68000,278,,0.0,0,,RPPQMLLJMHGGFDA17CC
信義區,建物,臺北市信義區光復南路415巷46號,0.0,住,,,1100307,土地0建物1車位0,一層,5,公寓(5樓含以下無電梯),商業用,鋼筋混凝土造,0740919,48.94,0,0,0,無,無,有,45000,919,,0.0,0,,RPSQMLLJMHGGFDA47CC
內湖區,建物,臺北市內湖區環山路二段２８之７號,0.0,住,,,1100316,土地0建物1車位0,一層,5,華廈(10層含以下有電梯),住家用,鋼筋混凝土造,1070928,76.6,2,1,1,有,有,有,38500,503,,0.0,0,,RPSNMLLJMHGGFCA07CC
內湖區,房地(土地+建物),臺北市內湖區內湖路一段411巷2號4樓,36.9,住,,,1100321,土地1建物1車位0,四層,4,公寓(5樓含以下無電梯),住家用,鋼筋混凝土造,0670321,86.63,3,1,1,有,無,無,20000,231,,0.0,0,,RPOPMLLJMHGGFCA86CC
中山區,建物,臺北市中山區南京東路二段２４巷３號四樓,0.0,商,,,1100316,土地0建物1車位0,四層,4,公寓(5樓含以下無電梯),住家用,鋼筋混凝土造,0620131,98.96,3,3,2,有,無,有,35000,354,,0.0,0,含增建或未登記建物。；租賃期間含免租金裝潢期。,RPWPMLLJMHGGFCA67CC
內湖區,建物,臺北市內湖區行善路398號五樓,0.0,工,,,1100319,土地0建物1車位6,五層,9,辦公商業大樓,見其他登記事項,鋼筋混凝土造,1010815,985.88,0,0,0,無,有,無,178500,181,坡道平面,0.0,0,,RPOQMLLJMHGGFCA96CC
內湖區,建物,臺北市內湖區民善街83號2樓,0.0,工,,,1100330,土地0建物1車位2,二層,7,辦公商業大樓,見其他登記事項,鋼筋混凝土造,0981225,331.73,0,0,0,無,有,無,88000,265,坡道平面,0.0,0,,RPPQMLLJMHGGFCA07CC
內湖區,建物,臺北市內湖區成功路4段188號11樓之3,0.0,其他,,,1100401,土地0建物1車位0,十一層,15,辦公商業大樓,見其他登記事項,鋼筋混凝土造,1050616,68.2,1,0,1,有,有,有,27000,396,,0.0,0,租金未含管理費,RPQQMLLJMHGGFCA17CC
中山區,建物,臺北市中山區中山北路一段121巷33號十二樓之3,0.0,商,,,1100313,土地0建物1車位0,十二層,14,住宅大樓(11層含以上有電梯),住家用,鋼筋混凝土造,1000128,96.36999999999999,2,1,1,有,有,有,53000,550,,0.0,0,續租。；含管理費、稅金或水電等費用。；,RPXQMLLJMHGGFCA87CC
內湖區,建物,臺北市內湖區瑞光路192號7樓之3,0.0,其他,,,1100309,土地0建物1車位0,七層,12,辦公商業大樓,工業用,見使用執照,0891106,370.77,5,1,0,有,有,有,136534,368,,0.0,0,,RPQRMLLJMHGGFCA27CC
中山區,建物,臺北市中山區長春路97號9樓,0.0,商,,,1100303,土地0建物1車位0,九層,13,住宅大樓(11層含以上有電梯),住家用,鋼筋混凝土造,1030529,228.45,3,2,2,有,有,有,95000,416,,0.0,0,,RPRRMLLJMHGGFCA37CC
中山區,建物,臺北市中山區民權西路9巷22號9樓之5,0.0,商,,,1100305,土地0建物1車位0,九層,14,套房(1房1廳1衛),見其他登記事項,鋼筋混凝土造,1011112,77.27,1,1,1,有,有,有,40000,518,,0.0,0,,RPSRMLLJMHGGFCA47CC
中山區,建物,臺北市中山區南京東路2段108號18樓之9,0.0,其他,,,1100305,土地0建物1車位0,十八層,18,住宅大樓(11層含以上有電梯),住家用,見其他登記事項,0990917,99.61000000000001,2,2,1,有,有,有,60000,602,,0.0,0,,RPTRMLLJMHGGFCA57CC
中山區,建物,臺北市中山區雙城街13巷21號13樓之1,0.0,商,,,1100305,土地0建物1車位0,十三層,14,住宅大樓(11層含以上有電梯),住家用,鋼筋混凝土造,0941207,136.18,2,2,2,有,有,有,57000,419,,0.0,0,,RPURMLLJMHGGFCA67CC
中山區,建物,臺北市中山區南京東路二段85、87號,0.0,商,,,1100331,土地0建物0車位0,三層,14,辦公商業大樓,商業用,鋼筋混凝土造,0721018,701.79,3,0,0,有,有,無,350279,499,,0.0,0,承租部份面積含公設約212.29坪。,RPVRMLLJMHGGFCA77CC
北投區,建物,臺北市北投區中央北路四段３５４巷２弄１０號三樓,0.0,住,,,1100316,土地0建物1車位0,三層,5,公寓(5樓含以下無電梯),住家用,鋼筋混凝土造,0720713,84.24,2,2,1,有,無,有,20000,237,,0.0,0,,RPPNMLLJMHGGFEA96CC
北投區,建物,臺北市北投區東華街二段２６號四樓,0.0,住,,,1100318,土地0建物1車位1,四層,12,住宅大樓(11層含以上有電梯),住家用,鋼筋混凝土造,1020923,173.42,3,2,2,有,有,有,58000,334,升降平面,24.0,0,,RPQNMLLJMHGGFEA07CC
士林區,建物,臺北市士林區延平北路六段273巷10號,0.0,住,,,1100312,土地0建物1車位0,四層,4,公寓(5樓含以下無電梯),住家用,鋼筋混凝土造,0600909,75.74,3,1,1,有,無,有,16000,211,,0.0,0,,RPTNMLLJMHGGFEA37CC
士林區,建物,臺北市士林區德行東路264號二樓,0.0,住,,,1100310,土地0建物1車位1,二層,10,華廈(10層含以下有電梯),住家用,鋼筋混凝土造,0960528,189.88,3,2,2,有,有,有,70000,369,坡道平面,0.0,0,續租。；含管理費、稅金或水電等費用。；,RPOPMLLJMHGGFEA07CC
士林區,建物,臺北市士林區中山北路六段2巷52號2樓,0.0,住,,,1100313,土地0建物1車位1,二層,7,華廈(10層含以下有電梯),住家用,鋼筋混凝土造,0740613,302.03000000000003,4,2,3,有,無,有,88000,291,坡道平面,36.17,0,,RPTPMLLJMHGGFEA57CC
北投區,建物,臺北市北投區自強街180巷8號二樓,0.0,商,,,1100305,土地0建物1車位0,二層,5,公寓(5樓含以下無電梯),住家用,鋼筋混凝土造,0700314,101.39,3,1,1,有,無,有,18500,182,,0.0,0,台北市都發局社會住宅包租代管計畫,RPVPMLLJMHGGFEA77CC
中正區,建物,臺北市中正區重慶南路三段27巷21號2樓,0.0,住,,,1100315,土地0建物1車位0,二層,7,華廈(10層含以下有電梯),見其他登記事項,鋼筋混凝土造,1050715,89.97,1,1,1,有,有,有,42500,472,,0.0,0,續租。；含管理費、稅金或水電等費用。；僅租賃部分面積,RPVNMLLJMHGGFAA17CC
中正區,建物,臺北市中正區汀州路一段350之5號,0.0,住,,,1100330,土地0建物1車位0,一層,23,店面(店鋪),見其他登記事項,鋼筋混凝土造,1081202,38.32,1,1,1,有,有,有,20000,522,,0.0,0,,RPOOMLLJMHGGFAA56CC
中正區,建物,臺北市中正區南昌路二段203號9樓之9,0.0,商,,,1100326,土地0建物1車位0,九層,11,住宅大樓(11層含以上有電梯),住家用,鋼骨鋼筋混凝土造,0940601,40.7,1,0,1,有,無,有,18000,442,,0.0,0,,RPWOMLLJMHGGFAA37CC
中正區,建物,臺北市中正區羅斯福路四段78巷1弄5號四樓,0.0,商,,,1100304,土地0建物1車位0,四層,5,公寓(5樓含以下無電梯),住家用,鋼筋混凝土造,0700812,84.65,3,2,1,有,無,有,26000,307,,0.0,0,住宅及都市更新中心108年社會住宅包租代管第二期計畫,RPXOMLLJMHGGFAA47CC
大安區,建物,臺北市大安區羅斯福路二段33號3樓之4,0.0,商,,,1100304,土地0建物1車位0,三層,12,住宅大樓(11層含以上有電梯),商業用,鋼筋混凝土造,,52.2,2,1,1,有,有,有,21800,418,,0.0,0,,RPWOMLLJMHGGFFA87CC
大安區,建物,臺北市大安區通安街30號2樓,0.0,住,,,1100331,土地0建物1車位0,二層,7,華廈(10層含以下有電梯),商業用,鋼筋混凝土造,0720816,91.92999999999999,3,2,2,有,有,有,48000,522,,0.0,0,,RPXOMLLJMHGGFFA97CC
大安區,建物,臺北市大安區忠孝東路三段１６２號二樓之１,0.0,商,,,1100314,土地0建物1車位0,二層,14,住宅大樓(11層含以上有電梯),商業用,鋼筋混凝土造,0760423,107.19,2,2,2,有,有,有,36000,336,,0.0,0,含增建或未登記建物。；租期內含免租裝潢期。房屋用途做住家及辦公室使用。,RPPPMLLJMHGGFFA27CC
內湖區,建物,臺北市內湖區新明路163號,0.0,工,,,1100325,土地0建物1車位0,一層,7,廠辦,見使用執照,鋼筋混凝土造,0701127,266.08,0,0,0,無,無,無,90000,338,,0.0,0,,RPSNMLMJMHGGFCA17CC
內湖區,房地(土地+建物)+車位,臺北市內湖區成功路二段452號3樓,0.0,住,,,1100319,土地0建物1車位1,三層,11,住宅大樓(11層含以上有電梯),見其他登記事項,鋼筋混凝土造,1090731,107.34,2,1,1,有,有,有,42000,391,升降平面,20.0,0,,RPTNMLMJMHGGFCA27CC
信義區,建物,臺北市信義區虎林街202巷60號,0.0,,,,1100329,土地0建物1車位0,一層,23,店面(店鋪),商業用,鋼骨鋼筋混凝土造,0831021,72.47,0,0,0,無,有,有,40000,552,,0.0,0,,RPQNMLMJMHGGFDA07CC
