桃園區,建物,桃園市桃園區中埔六街39號,0.0,住,,,1100129,土地0建物1車位0,七層,9,華廈(10層含以下有電梯),住家用,鋼筋混凝土造,0930519,47.489999999999995,1,1,1,有,無,有,8500,179,,0.0,0,社會住宅 管理費每月1020元,RPSPMLRJMHGGFAH38CC
桃園區,建物,桃園市桃園區同德二街59號二樓,0.0,住,,,1100118,土地0建物1車位0,二層,9,華廈(10層含以下有電梯),住家用,鋼筋混凝土造,0920109,101.07,3,2,2,有,有,有,17500,173,,0.0,0,,RPTRMLRJMHGGFAH68CC
桃園區,建物,桃園市桃園區文中二路19之1號十一樓,0.0,住,,,1100118,土地0建物1車位0,十一層,12,住宅大樓(11層含以上有電梯),住家用,鋼筋混凝土造,1080520,136.25,3,2,2,有,有,有,23000,169,,0.0,0,社會住宅另有提供車位，無償使用,RPQSMLRJMHGGFAH48CC
桃園區,建物,桃園市桃園區大興西路二段200之18號三號,0.0,住,,,1100119,土地0建物1車位0,三層,14,住宅大樓(11層含以上有電梯),住家用,鋼筋混凝土造,0921114,68.80000000000001,2,1,1,有,有,有,13500,196,,0.0,0,,RPUSMLRJMHGGFAH88CC
桃園區,建物,桃園市桃園區莊敬路一段342之4號十樓之2,0.0,住,,,1100119,土地0建物1車位0,十層,14,住宅大樓(11層含以上有電梯),住家用,鋼筋混凝土造,0900223,149.51,4,2,2,有,有,有,21900,146,,0.0,0,社會住宅另有提供車位，無償使用,RPPTMLRJMHGGFAH48CC
桃園區,建物,桃園市桃園區同德十一街37巷22之4號,0.0,住,,,1100121,土地0建物1車位0,五層,5,華廈(10層含以下有電梯),住家用,鋼筋混凝土造,0780126,152.22,4,2,2,有,有,有,19000,125,,0.0,0,,RPQUMLRJMHGGFAH68CC
桃園區,建物,桃園市桃園區國強二街217號7樓,0.0,住,,,1100121,土地0建物1車位0,七層,13,住宅大樓(11層含以上有電梯),住家用,鋼筋混凝土造,0830317,123.59,4,2,2,有,有,有,13400,108,,0.0,0,,RPTUMLRJMHGGFAH98CC
桃園區,建物,桃園市桃園區大興西路二段59號9樓之1,0.0,住,,,1100122,土地0建物1車位0,九層,11,住宅大樓(11層含以上有電梯),住家用,鋼筋混凝土造,0850713,115.97999999999999,3,2,2,有,有,有,16000,138,,0.0,0,,RPOVMLRJMHGGFAH58CC
桃園區,建物,桃園市桃園區大德一街65號4樓,0.0,住,,,1100123,土地0建物1車位0,四層,6,華廈(10層含以下有電梯),住家用,鋼筋混凝土造,0821111,63.64,2,2,1,有,有,有,11200,176,,0.0,0,社會住宅另有提供車位，無償使用,RPONNLRJMHGGFAH87CC
楊梅區,房地(土地+建物)+車位,桃園市楊梅區四維路169號9樓之1,18.25,住,,,1100324,土地1建物1車位1,九層,12,住宅大樓(11層含以上有電梯),見其他登記事項,鋼筋混凝土造,0960726,137.60000000000002,2,2,1,有,有,無,16000,116,坡道平面,0.0,0,,RPUOMLSJMHGGFDH88CC
蘆竹區,房地(土地+建物)+車位,桃園市蘆竹區大興八街13號10樓之5,18.97,住,,,1100401,土地1建物1車位1,見其他登記事項,13,住宅大樓(11層含以上有電梯),住家用,鋼筋混凝土造,1050318,153.75,4,2,2,有,有,有,24000,156,坡道平面,24.49,0,含家電、家具,RPSNMLSJMHGGFEH68CC
蘆竹區,建物,桃園市蘆竹區新興街138-2號3樓,0.0,,一般農業區,丁種建築用地,1100301,土地0建物0車位0,三層,9,華廈(10層含以下有電梯),見其他登記事項,鋼筋混凝土造,0990624,33.95,1,0,1,有,無,有,6000,177,,0.0,0,,RPXNMLSJMHGGFEH56CC
蘆竹區,建物,桃園市蘆竹區新興街138-1號3樓,0.0,,一般農業區,丁種建築用地,1100308,土地0建物0車位0,三層,9,華廈(10層含以下有電梯),見其他登記事項,鋼筋混凝土造,0990624,30.76,1,0,1,有,無,有,6500,211,,0.0,0,,RPSOMLSJMHGGFEH78CC
蘆竹區,建物,桃園市蘆竹區新興街140巷16號3樓,0.0,,一般農業區,丁種建築用地,1100301,土地0建物0車位0,三層,9,華廈(10層含以下有電梯),見其他登記事項,鋼筋混凝土造,0990624,30.6,1,0,1,有,無,有,6500,212,,0.0,0,,RPUOMLSJMHGGFEH98CC
蘆竹區,建物,桃園市蘆竹區新興街140巷36號6樓,0.0,,一般農業區,甲種建築用地,1100307,土地0建物0車位0,六層,6,華廈(10層含以下有電梯),住家用,鋼筋混凝土造,0970820,34.8,1,0,1,有,無,有,6000,172,,0.0,0,,RPWOMLSJMHGGFEH56CC
蘆竹區,建物,桃園市蘆竹區中山路101號10樓之2,0.0,住,,,1100401,土地0建物1車位0,十層,16,住宅大樓(11層含以上有電梯),住家用,鋼筋混凝土造,0830811,79.5,2,1,1,有,有,有,16000,201,,0.0,0,管理費由承租人負擔1229元整,RPTQMLSJMHGGFEH09CC
蘆竹區,建物,桃園市蘆竹區中正路306號18樓之3,0.0,住,,,1100125,土地0建物1車位0,十八層,18,住宅大樓(11層含以上有電梯),住家用,鋼筋混凝土造,0850213,46.65,1,0,0,無,有,有,11600,249,,0.0,0,,RPVQMLSJMHGGFEH66CC
蘆竹區,建物,桃園市蘆竹區興中街57號九樓之2,0.0,商,,,1100209,土地0建物1車位0,九層,12,住宅大樓(11層含以上有電梯),住家用,鋼筋混凝土造,0951105,82.76,2,1,1,有,有,有,14800,179,,0.0,0,社會住宅另有提供車位，無償使用,RPPRMLSJMHGGFEH78CC
蘆竹區,建物,桃園市蘆竹區南崁路一段326號7樓之3,0.0,其他,,,1100222,土地0建物1車位0,七層,9,華廈(10層含以下有電梯),見其他登記事項,鋼筋混凝土造,0811113,68.97,2,2,1,有,有,有,13000,188,,0.0,0,,RPQRMLSJMHGGFEH88CC
八德區,建物,桃園市八德區中華路35號五樓,0.0,住,,,1100313,土地0建物1車位0,五層,15,住宅大樓(11層含以上有電梯),住家用,鋼筋混凝土造,0970425,82.24000000000001,2,1,1,有,有,有,13500,164,,0.0,0,租賃範圍不含車位，且無法區分車位面積。；,RPOOMLSJMHGGFFH48CC
八德區,建物,桃園市八德區大忠街112號5樓,0.0,住,,,1100403,土地0建物1車位0,五層,10,華廈(10層含以下有電梯),住家用,鋼筋混凝土造,0961127,129.17,3,2,2,有,有,有,16000,124,,0.0,0,,RPUOMLSJMHGGFFH09CC
八德區,建物,桃園市八德區永福街131之3號,0.0,住,,,1100125,土地0建物1車位0,四層,4,公寓(5樓含以下無電梯),住家用,鋼筋混凝土造,0701221,63.21,2,1,1,有,無,有,10000,158,,0.0,0,,RPVOMLSJMHGGFFH56CC
八德區,房地(土地+建物),桃園市八德區建國路903號,5.38,,一般農業區,甲種建築用地,1100309,土地1建物0車位0,全,5,透天厝,住商用,鋼筋混凝土造,0841002,19.44,1,0,1,有,無,有,8500,437,,0.0,0,隔間套房,RPTPMLSJMHGGFFH09CC
平鎮區,建物,桃園市平鎮區大興街59號6樓,0.0,住,,,1100209,土地0建物1車位0,六層,13,住宅大樓(11層含以上有電梯),見其他登記事項,鋼筋混凝土造,1090831,115.18,3,2,2,有,無,有,17000,148,,0.0,0,社會住宅另有提供車位，無償使用,RPXOMLSJMHGGFGH86CC
龜山區,土地,山頂段121-5地號,139.0,,鄉村區,乙種建築用地,1100324,土地1建物0車位0,,,其他,,,,0.0,0,0,0,有,無,有,22000,158,,0.0,0,土地上有建物，建物無保存登記。,RPQTMLSJMHGGFHH86DC
中壢區,房地(土地+建物),桃園市中壢區領航南路二段195.197號一樓,50.05,住,,,1100401,土地1建物1車位0,一層,9,店面(店鋪),見其他登記事項,鋼筋混凝土造,0990812,172.91,3,0,0,無,有,無,45000,260,,0.0,0,,RPQPMLSJMHGGFBH48DC
中壢區,房地(土地+建物)+車位,桃園市中壢區民權路四段740號,11.36,住,,,1100401,土地1建物1車位2,一層,10,華廈(10層含以下有電梯),見其他登記事項,鋼筋混凝土造,1020220,69.47,4,0,0,無,有,有,31000,446,坡道平面,21.46,0,,RPVPMLSJMHGGFBH98DC
中壢區,房地(土地+建物)+車位,桃園市中壢區高鐵南路二段223號2樓,43.55,住,,,1100305,土地1建物1車位2,二層,12,住宅大樓(11層含以上有電梯),見其他登記事項,鋼筋混凝土造,1040706,98.31,0,1,1,有,有,有,85000,865,坡道平面,24.06,0,,RPTQMLSJMHGGFBH88DC
中壢區,房地(土地+建物),桃園市中壢區元化路89巷31弄13號,24.81,住,,,1100324,土地1建物1車位0,全,2,透天厝,住家用,加強磚造,0620724,19.57,4,3,2,有,無,有,15000,766,,0.0,0,,RPQRMLSJMHGGFBH68DC
桃園區,房地(土地+建物),桃園市桃園區中正路1418號6樓,6.22,住,,,1100401,土地1建物1車位0,六層,12,住宅大樓(11層含以上有電梯),住家用,鋼筋混凝土造,0830630,56.39,0,0,1,有,無,無,9000,160,,0.0,0,,RPSNMLSJMHGGFAH28CC
桃園區,建物,桃園市桃園區桃一街52號2樓,0.0,住,,,1100311,土地0建物1車位0,二層,12,住宅大樓(11層含以上有電梯),住家用,鋼筋混凝土造,0831029,142.70999999999998,4,2,2,有,有,有,20000,140,,0.0,0,,RPPRMLSJMHGGFAH38CC
桃園區,建物,桃園市桃園區新生路103號,0.0,商,,,1100310,土地0建物1車位0,一層,15,店面(店鋪),見其他登記事項,鋼筋混凝土造,1080528,93.48,0,0,0,無,有,無,19990,214,,0.0,0,,RPRRMLSJMHGGFAH58CC
桃園區,建物,桃園市桃園區同安街664號四樓,0.0,住,,,1100311,土地0建物1車位0,四層,10,華廈(10層含以下有電梯),住家用,鋼筋混凝土造,0830713,107.16999999999999,3,2,2,有,有,有,14000,131,,0.0,0,,RPTRMLSJMHGGFAH78CC
桃園區,建物,桃園市桃園區江南十街20號七樓,0.0,其他,,,1100127,土地0建物1車位0,七層,13,住宅大樓(11層含以上有電梯),住家用,鋼筋混凝土造,0821104,107.95,3,2,2,有,有,有,14000,130,,0.0,0,,RPQUMLSJMHGGFAH78CC
桃園區,建物,桃園市桃園區民有十二街15號2樓,0.0,住,,,1100128,土地0建物1車位0,二層,13,住宅大樓(11層含以上有電梯),住家用,鋼筋混凝土造,1030520,94.24000000000001,2,2,1,有,有,有,20200,214,,0.0,0,社會住宅另有提供車位，無償使用,RPUUMLSJMHGGFAH56CC
桃園區,建物,桃園市桃園區中埔一街342號6樓,0.0,住,,,1100129,土地0建物1車位0,六層,7,華廈(10層含以下有電梯),住家用,鋼筋混凝土造,0850513,102.46000000000001,4,2,2,有,有,有,16600,162,,0.0,0,,RPOVMLSJMHGGFAH68CC
桃園區,建物,桃園市桃園區大興西路二段139巷169號8樓,0.0,住,,,1100209,土地0建物1車位0,八層,12,住宅大樓(11層含以上有電梯),住家用,鋼筋混凝土造,0970424,60.15,2,1,1,有,有,有,15600,259,,0.0,0,社會住宅另有提供車位，無償使用,RPOWMLSJMHGGFAH78CC
桃園區,建物,桃園市桃園區民生路286號7樓之6,0.0,商,,,1100205,土地0建物1車位0,七層,10,華廈(10層含以下有電梯),住家用,鋼筋混凝土造,0710219,57.77,1,0,0,無,有,有,10000,173,,0.0,0,,RPRNNLSJMHGGFAH28CC
桃園區,建物,桃園市桃園區國強七街１０８號一樓,0.0,住,,,1100323,土地0建物1車位0,一層,7,店面(店鋪),見其他登記事項,鋼筋混凝土造,0860214,82.09,1,1,1,有,有,無,18000,219,,0.0,0,租金含管理費。,RPWNNLSJMHGGFAH78CC
桃園區,房地(土地+建物),桃園市桃園區大原路27號,8.6,住,,,1100310,土地1建物0車位0,二層,4,套房(1房1廳1衛),住家用,鋼筋混凝土造,0830625,30.96,1,0,1,有,無,有,9500,307,,0.0,0,含增建或未登記建物。；,RPXONLSJMHGGFAH98CC
中壢區,建物,桃園市中壢區興安一街36-1號13樓,0.0,,,,1100321,土地0建物0車位0,十三層,13,住宅大樓(11層含以上有電梯),住家用,鋼筋混凝土造,0970429,42.22,1,0,1,有,無,有,6500,154,,0.0,0,,RPSOMLSJMHGGFBH48CC
中壢區,建物,桃園市中壢區興安一街50-2號3樓,0.0,,,,1100321,土地0建物0車位0,三層,13,住宅大樓(11層含以上有電梯),住家用,鋼筋混凝土造,0970429,42.22,1,0,1,有,無,有,6500,154,,0.0,0,,RPVOMLSJMHGGFBH78CC
中壢區,建物,桃園市中壢區興安一街52-2號11樓,0.0,,,,1100301,土地0建物0車位0,十一層,13,住宅大樓(11層含以上有電梯),住家用,鋼筋混凝土造,0970429,41.04,1,0,1,有,無,有,5800,141,,0.0,0,,RPXOMLSJMHGGFBH98CC
中壢區,建物,桃園市中壢區興安一街50-1號12樓,0.0,,,,1100311,土地0建物0車位0,十二層,13,住宅大樓(11層含以上有電梯),住家用,鋼筋混凝土造,0970429,41.36,1,0,1,有,無,有,7000,169,,0.0,0,,RPOPMLSJMHGGFBH18CC
中壢區,建物,桃園市中壢區興安一街48-1號2樓,0.0,,,,1100311,土地0建物0車位0,二層,13,住宅大樓(11層含以上有電梯),住家用,鋼筋混凝土造,0970429,41.64,1,0,1,有,無,有,6700,161,,0.0,0,,RPPPMLSJMHGGFBH28CC
中壢區,建物,桃園市中壢區興安一街48-1號3樓,0.0,,,,1100306,土地0建物0車位0,三層,13,住宅大樓(11層含以上有電梯),住家用,鋼筋混凝土造,0970429,41.64,1,0,1,有,無,有,6300,151,,0.0,0,,RPRPMLSJMHGGFBH48CC
中壢區,建物,桃園市中壢區興安一街48-1號3樓,0.0,,,,1100316,土地0建物0車位0,三層,13,住宅大樓(11層含以上有電梯),住家用,鋼筋混凝土造,0970429,41.64,1,0,1,有,無,有,650,16,,0.0,0,,RPSPMLSJMHGGFBH58CC
中壢區,建物,桃園市中壢區興安一街48-2號3樓,0.0,,,,1100401,土地0建物0車位0,三層,13,住宅大樓(11層含以上有電梯),住家用,鋼筋混凝土造,0970429,41.64,1,0,1,有,無,有,6500,156,,0.0,0,,RPTPMLSJMHGGFBH68CC
中壢區,建物,桃園市中壢區普義路228號,0.0,住,,,1100325,土地0建物1車位0,全,2,透天厝,住家用,加強磚造,,66.12,0,0,0,無,無,無,18000,272,,0.0,0,續租。；租金未稅。租賃範圍是1樓前段。,RPWPMLSJMHGGFBH98CC
中壢區,建物,桃園市中壢區興安一街48-1號3樓,0.0,,,,1100326,土地0建物0車位0,三層,13,住宅大樓(11層含以上有電梯),住家用,鋼筋混凝土造,0970429,41.64,1,0,1,有,無,有,6000,144,,0.0,0,,RPXPMLSJMHGGFBH09CC
中壢區,建物,桃園市中壢區興安一街48-2號3樓,0.0,,,,1100301,土地0建物0車位0,三層,13,住宅大樓(11層含以上有電梯),住家用,鋼筋混凝土造,0970429,41.64,1,0,1,有,無,有,6500,156,,0.0,0,,RPOQMLSJMHGGFBH28CC
中壢區,建物,桃園市中壢區興安一街48-1號9樓,0.0,,,,1100301,土地0建物0車位0,九層,13,住宅大樓(11層含以上有電梯),住家用,鋼筋混凝土造,0970429,41.64,1,0,1,有,無,有,6800,163,,0.0,0,,RPQQMLSJMHGGFBH48CC
中壢區,建物,桃園市中壢區興安一街48-2號11樓,0.0,,,,1100321,土地0建物0車位0,十一層,13,住宅大樓(11層含以上有電梯),住家用,鋼筋混凝土造,0970429,41.64,1,0,1,有,無,有,6000,144,,0.0,0,,RPSQMLSJMHGGFBH68CC
中壢區,建物,桃園市中壢區興安一街48號6樓,0.0,,,,1100316,土地0建物0車位0,六層,13,住宅大樓(11層含以上有電梯),住家用,鋼筋混凝土造,0970429,42.22,1,0,1,有,無,有,6500,154,,0.0,0,,RPWQMLSJMHGGFBH09CC
中壢區,建物,桃園市中壢區興安一街40-1號11樓,0.0,,,,1100301,土地0建物0車位0,十一層,13,住宅大樓(11層含以上有電梯),住家用,鋼筋混凝土造,0970429,41.64,1,0,1,有,無,有,6500,156,,0.0,0,,RPXQMLSJMHGGFBH56CC
中壢區,建物,桃園市中壢區興安一街38號3樓,0.0,,,,1100317,土地0建物0車位0,三層,13,住宅大樓(11層含以上有電梯),住家用,鋼筋混凝土造,0970429,42.22,1,0,1,有,無,有,6500,154,,0.0,0,,RPPRMLSJMHGGFBH48CC
中壢區,建物,桃園市中壢區興安一街38號3樓,0.0,,,,1100321,土地0建物0車位0,三層,13,住宅大樓(11層含以上有電梯),住家用,鋼筋混凝土造,0970429,42.22,1,0,1,有,無,有,6500,154,,0.0,0,,RPRRMLSJMHGGFBH68CC
中壢區,建物,桃園市中壢區興安一街38-1號3樓,0.0,,,,1100301,土地0建物0車位0,三層,13,住宅大樓(11層含以上有電梯),住家用,鋼筋混凝土造,0970429,42.51,1,0,1,有,無,有,6000,141,,0.0,0,,RPSRMLSJMHGGFBH78CC
中壢區,建物,桃園市中壢區興安一街38-1號10樓,0.0,,,,1100301,土地0建物0車位0,十層,13,住宅大樓(11層含以上有電梯),住家用,鋼筋混凝土造,0970429,41.64,1,0,1,有,無,有,6000,144,,0.0,0,,RPTRMLSJMHGGFBH88CC
中壢區,建物,桃園市中壢區興安一街38-1號12樓,0.0,,,,1100301,土地0建物0車位0,十二層,13,住宅大樓(11層含以上有電梯),住家用,鋼筋混凝土造,0970429,41.64,1,0,1,有,無,有,6500,156,,0.0,0,,RPURMLSJMHGGFBH98CC
中壢區,房地(土地+建物),桃園市中壢區寶慶街56號4樓,16.9,住,,,1100403,土地1建物1車位0,全,4,透天厝,住家用,鋼筋混凝土造,0720805,16.9,1,0,1,有,無,有,7500,444,,0.0,0,,RPSSMLSJMHGGFBH88CC
中壢區,建物,桃園市中壢區九和三街１０號八樓之１,0.0,住,,,1100321,土地0建物1車位1,八層,15,住宅大樓(11層含以上有電梯),住家用,鋼筋混凝土造,0870804,168.44,4,2,2,有,有,有,23000,137,坡道平面,37.34,0,,RPTTMLSJMHGGFBH09CC
中壢區,建物,桃園市中壢區環西路二段２９６號二樓,0.0,住,,,1100321,土地0建物1車位1,二層,15,住宅大樓(11層含以上有電梯),見其他登記事項,鋼筋混凝土造,1000628,177.42000000000002,4,2,2,有,有,有,22000,124,坡道平面,15.52,0,租金含管理費。,RPVTMLSJMHGGFBH66CC
中壢區,建物,桃園市中壢區光輝街107巷2號2樓,0.0,住,,,1100329,土地0建物1車位0,二層,4,公寓(5樓含以下無電梯),住家用,鋼筋混凝土造,0690919,80.05,3,1,1,有,無,有,13000,162,,0.0,0,,RPOUMLSJMHGGFBH68CC
中壢區,建物,桃園市中壢區三光路１４０之１號二樓,0.0,住,,,1100325,土地0建物1車位0,二層,5,公寓(5樓含以下無電梯),住家用,鋼筋混凝土造,0740508,110.43,3,2,1,有,無,有,10000,91,,0.0,0,租賃期間含免租金裝潢期。,RPQWMLSJMHGGFBH09CC
中壢區,建物,桃園市中壢區環中東路二段312巷6號12樓之2,0.0,住,,,1100217,土地0建物1車位0,十二層,14,住宅大樓(11層含以上有電梯),住家用,鋼筋混凝土造,0880528,93.11999999999999,3,2,1,有,有,有,14700,158,,0.0,0,社會住宅另有提供車位，無償使用,RPUWMLSJMHGGFBH86CC
中壢區,建物,桃園市中壢區陸光一街16號3樓,0.0,住,,,1100223,土地0建物1車位0,三層,14,住宅大樓(11層含以上有電梯),住家用,鋼筋混凝土造,0911114,168.48,3,2,2,有,有,有,13800,82,,0.0,0,社會住宅另有提供車位，無償使用,RPPNNLSJMHGGFBH18CC
中壢區,建物,桃園市中壢區中華路二段３０４號,0.0,住,,,1100323,土地0建物1車位0,見其他登記事項,2,店面(店鋪),住家用,加強磚造,0530701,69.84,0,4,2,有,無,有,18500,265,,0.0,0,含增建或未登記建物。；,RPSNNLSJMHGGFBH48CC
中壢區,房地(土地+建物),桃園市中壢區成功路133巷16弄7號,5.2,住,,,1100314,土地1建物0車位0,全,5,透天厝,住家用,加強磚造,0590410,16.2,1,0,1,有,無,有,7000,432,,0.0,0,隔間套房,RPOONLSJMHGGFBH18CC
中壢區,房地(土地+建物),桃園市中壢區成功路133巷16弄7號,5.2,住,,,1100309,土地1建物0車位0,全,5,透天厝,住家用,加強磚造,0590410,23.4,1,0,1,有,無,有,8500,363,,0.0,0,隔間套房,RPPONLSJMHGGFBH28CC
中壢區,房地(土地+建物),桃園市中壢區成功路94巷35-3號,4.78,住,,,1100316,土地1建物0車位0,全,5,透天厝,住家用,鋼筋混凝土造,0800213,23.04,1,0,1,有,無,有,8000,347,,0.0,0,隔間套房,RPQONLSJMHGGFBH38CC
楊梅區,建物,桃園市楊梅區永美路445巷36弄1號,0.0,住,,,1100310,土地0建物1車位0,全,2,透天厝,住家用,加強磚造,0670721,62.9,3,2,2,有,無,有,12000,191,,0.0,0,社會住宅,RPQNMLTJMHGGFDH48CC
楊梅區,建物,桃園市楊梅區中山北路一段390巷45弄46號10樓之2,0.0,住,,,1100315,土地0建物1車位0,十層,13,住宅大樓(11層含以上有電梯),住家用,鋼筋混凝土造,0830625,99.93,3,1,2,有,有,有,10000,100,,0.0,0,社會住宅管理費另計900元,RPRNMLTJMHGGFDH58CC
楊梅區,建物,桃園市楊梅區環南路223巷43號六樓,0.0,住,,,1100319,土地0建物1車位0,六層,6,華廈(10層含以下有電梯),住家用,鋼筋混凝土造,0850430,112.25999999999999,3,1,2,有,有,有,9000,80,,0.0,0,社會住宅,RPSNMLTJMHGGFDH68CC
楊梅區,建物,桃園市楊梅區金山街320號十四樓,0.0,住,,,1100310,土地0建物1車位0,四層,15,住宅大樓(11層含以上有電梯),住家用,鋼筋混凝土造,1040525,93.37,2,1,1,有,有,有,13300,142,,0.0,0,社會住宅管理費另計1700元租賃車位1個租金另計0元、機車位1個,RPTNMLTJMHGGFDH78CC
楊梅區,建物,桃園市楊梅區金山街275巷70號四樓,0.0,住,,,1100315,土地0建物1車位0,四層,15,住宅大樓(11層含以上有電梯),見其他登記事項,鋼筋混凝土造,1091218,90.95,2,2,1,有,有,有,13000,143,,0.0,0,社會住宅管理費另計1500元，停車位管理費1000元租賃車位1個租金另計0元，機車位1個,RPXNMLTJMHGGFDH56CC
楊梅區,建物,桃園市楊梅區中山北路一段494巷72號二樓,0.0,住,,,1100316,土地0建物1車位0,二層,15,住宅大樓(11層含以上有電梯),見其他登記事項,鋼筋混凝土造,1091218,87.31,2,1,1,有,有,有,12500,143,,0.0,0,社會住宅管理費另計2500元租賃車位1個租金另計0元，機車位1個,RPOOMLTJMHGGFDH38CC
楊梅區,建物,桃園市楊梅區金山街109號四樓之3,0.0,住,,,1100305,土地0建物1車位0,四層,11,住宅大樓(11層含以上有電梯),住家用,鋼筋混凝土造,0841227,79.41,3,2,2,有,有,有,10000,126,,0.0,0,社會住宅管理費另計1200元，停車位管理費另計800元租賃車位1個租金另計0元、機車位1個,RPPOMLTJMHGGFDH48CC
楊梅區,建物,桃園市楊梅區青山三街36巷8號七樓,0.0,住,,,1100217,土地0建物1車位0,七層,9,華廈(10層含以下有電梯),住家用,鋼筋混凝土造,0950305,90.32000000000001,2,2,1,有,有,有,10500,116,,0.0,0,社會住宅管理費另計1500元租賃車位1個租金另計1500元,RPQOMLTJMHGGFDH58CC
楊梅區,建物,桃園市楊梅區中山南路618之1號九樓,0.0,住,,,1100219,土地0建物1車位0,九層,14,住宅大樓(11層含以上有電梯),見其他登記事項,鋼筋混凝土造,1071105,93.96,2,1,1,有,有,有,12300,131,,0.0,0,社會住宅管理費另計1700元,RPROMLTJMHGGFDH68CC
楊梅區,建物,桃園市楊梅區新農街二段118號四樓,0.0,住,,,1100322,土地0建物1車位0,四層,9,華廈(10層含以下有電梯),住家用,鋼筋混凝土造,1020502,124.79,3,2,2,有,有,有,17000,136,,0.0,0,社會住宅管理費另計2500元、停車位管理費500元租賃車位1個租金另計0元、機車位,RPSOMLTJMHGGFDH78CC
楊梅區,建物,桃園市楊梅區環南路219巷35弄17號,0.0,住,,,1100309,土地0建物1車位0,全,4,透天厝,見其他登記事項,鋼筋混凝土造,1091008,208.74,4,2,2,有,有,有,13000,62,,0.0,0,社會住宅管理費另計2000元,RPTOMLTJMHGGFDH88CC
楊梅區,建物,桃園市楊梅區新農街二段110巷16號,0.0,住,,,1100219,土地0建物1車位0,一層,9,華廈(10層含以下有電梯),住家用,鋼筋混凝土造,1020502,89.22,2,2,1,有,有,有,13500,151,,0.0,0,社會住宅管理費另計1500元租賃車位1個租金另計0元、機車位1個,RPUOMLTJMHGGFDH98CC
楊梅區,建物,桃園市楊梅區中山北路一段390巷33之2號,0.0,住,,,1100202,土地0建物1車位0,一層,8,華廈(10層含以下有電梯),住商用,鋼筋混凝土造,0820817,88.58,3,2,2,有,有,有,11000,124,,0.0,0,社會住宅管理費另計1000元,RPVOMLTJMHGGFDH09CC
楊梅區,建物,桃園市楊梅區東森路59巷22號三樓,0.0,,山坡地保育區,丙種建築用地,1100319,土地0建物1車位0,全,4,透天厝,見其他登記事項,鋼筋混凝土造,0960315,170.2,3,2,2,有,有,有,14000,82,,0.0,0,社會住宅管理費另計2574元,RPWOMLTJMHGGFDH56CC
楊梅區,建物,桃園市楊梅區新農街660號二樓,0.0,住,,,1100315,土地0建物1車位0,二層,14,住宅大樓(11層含以上有電梯),住家用,鋼筋混凝土造,1030107,110.5,3,1,1,有,有,有,14000,127,,0.0,0,社會住宅管理費另計2000元租賃車位1個租金另計0元、機車位1個,RPXOMLTJMHGGFDH66CC
楊梅區,建物,桃園市楊梅區中山北路一段390巷33之3號五樓,0.0,住,,,1100311,土地0建物1車位0,五層,8,華廈(10層含以下有電梯),住家用,鋼筋混凝土造,0820817,100.44,3,2,2,有,有,有,10200,102,,0.0,0,社會住宅管理費另計800元,RPOPMLTJMHGGFDH48CC
楊梅區,建物,桃園市楊梅區新梅八街55號二樓,0.0,住,,,1100318,土地0建物1車位0,二層,12,住宅大樓(11層含以上有電梯),見其他登記事項,鋼筋混凝土造,1091007,117.6,3,2,2,有,有,有,15500,132,,0.0,0,社會住宅管理費另計2700元、停車位管理費800元租賃車位1個租金另計0元、機車位1個,RPPPMLTJMHGGFDH58CC
楊梅區,建物,桃園市楊梅區青山二街382號七樓之12,0.0,住,,,1100225,土地0建物1車位0,七層,15,套房(1房1廳1衛),住家用,鋼筋混凝土造,0840324,41.79,0,0,0,無,有,有,6500,156,,0.0,0,社會住宅管理費另計700元,RPQPMLTJMHGGFDH68CC
楊梅區,建物,桃園市楊梅區新農街362號二樓,0.0,住,,,1100218,土地0建物1車位0,二層,9,華廈(10層含以下有電梯),住家用,鋼筋混凝土造,0860911,114.27,3,2,2,有,無,有,13500,118,,0.0,0,社會住宅租賃車位1個租金另計0元停車位管理費另計500元,RPRPMLTJMHGGFDH78CC
楊梅區,建物,桃園市楊梅區青山一街117之1號三樓,0.0,住,,,1100315,土地0建物1車位0,三層,15,住宅大樓(11層含以上有電梯),見其他登記事項,鋼筋混凝土造,1080418,91.75,2,2,1,有,有,有,11500,125,,0.0,0,社會住宅管理費另計2000元,RPSPMLTJMHGGFDH88CC
楊梅區,建物,桃園市楊梅區三民北路162巷3號六樓,0.0,住,,,1100318,土地0建物1車位0,六層,9,華廈(10層含以下有電梯),住家用,鋼筋混凝土造,0841230,139.88,4,2,2,有,有,有,15400,110,,0.0,0,社會住宅管理費另計1500元、停車位管理費100元租賃車位1個租金另計0元,RPTPMLTJMHGGFDH98CC
楊梅區,建物,桃園市楊梅區青山一街115之1號15樓,0.0,住,,,1100305,土地0建物1車位0,十五層,15,住宅大樓(11層含以上有電梯),見其他登記事項,鋼筋混凝土造,1080418,91.75,2,2,1,有,有,有,11300,123,,0.0,0,社會住宅管理費另計2200元租賃機車位1個租金另計0元,RPUPMLTJMHGGFDH09CC
楊梅區,建物,桃園市楊梅區中山北路二段268巷22號四樓,0.0,住,,,1100209,土地0建物1車位0,四層,4,公寓(5樓含以下無電梯),住家用,鋼筋混凝土造,0681003,97.25,3,2,1,有,無,有,8000,82,,0.0,0,社會住宅,RPXPMLTJMHGGFDH76CC
楊梅區,建物,桃園市楊梅區光裕南路102巷10號,0.0,,山坡地保育區,丙種建築用地,1100303,土地0建物1車位0,全,5,透天厝,見其他登記事項,鋼筋混凝土造,0870807,198.51,3,2,3,有,無,有,14000,71,,0.0,0,社會住宅,RPQQMLTJMHGGFDH78CC
