鄉鎮市區,交易標的,土地位置建物門牌,土地面積平方公尺,都市土地使用分區,非都市土地使用分區,非都市土地使用編定,租賃年月日,租賃筆棟數,租賃層次,總樓層數,建物型態,主要用途,主要建材,建築完成年月,建物總面積平方公尺,建物現況格局-房,建物現況格局-廳,建物現況格局-衛,建物現況格局-隔間,有無管理組織,有無附傢俱,總額元,單價元平方公尺,車位類別,車位面積平方公尺,車位總額元,備註,編號
The villages and towns urban district,transaction sign,land sector position building sector house number plate,land shifting total area square meter,the use zoning or compiles and checks,the non-metropolis land use district,non-metropolis land use,transaction year month and day,transaction pen number,shifting level,total floor number,building state,main use,main building materials,construction to complete the years,building shifting total area,Building present situation pattern - room,building present situation pattern - hall,building present situation pattern - health,building present situation pattern - compartmented,Whether there is manages the organization,Whether there is attaches the furniture,total price NTD,the unit price (NTD / square meter),the berth category,berth shifting total area square meter,the berth total price NTD,the note,serial number
花蓮市,房地(土地+建物),花蓮縣花蓮市中山路16巷30號,191.0,住,,,1100315,土地2建物1車位0,全,2,透天厝,住家用,鋼筋混凝土造,0790312,227.5,5,3,3,有,無,無,24000,105,,0.0,0,,RPWNMLPKLHGGFAU07CC
壽豐鄉,房地(土地+建物),花蓮縣壽豐鄉豐山村中山路261巷6弄28號,1012.43,,特定農業區,農牧用地,1100314,土地1建物1車位0,見其他登記事項,2,農舍,農舍,鋼架造,0841222,301.6,10,2,10,有,無,有,35000,,,0.0,0,,RPROMLPKLHGGFAU66CC
花蓮市,房地(土地+建物),花蓮縣花蓮市國民八街5號四樓之6,12.34,商,,,1100315,土地1建物1車位0,四層,12,華廈(10層含以下有電梯),集合住宅,鋼筋混凝土造,1080925,48.62,2,1,1,有,無,有,19000,391,,0.0,0,,RPOPMLPKLHGGFAU09CC
花蓮市,房地(土地+建物),花蓮縣花蓮市國聯五路2之8號8樓,1.62,商,,,1100311,土地1建物1車位0,八層,7,華廈(10層含以下有電梯),瞭望台、住宅,鋼筋混凝土造,0761104,20.98,1,1,1,有,無,有,7000,334,,0.0,0,,RPOPMLQKLHGGFAU56CC
花蓮市,建物,花蓮縣花蓮市中華路498巷2-1號2樓,0.0,住,,,1100313,土地0建物0車位0,二層,2,套房(1房1廳1衛),住商用,鋼筋混凝土造,0661118,16.52,1,1,1,有,無,有,4600,278,,0.0,0,,RPQNMLRKLHGGFAU66CC
吉安鄉,房地(土地+建物),花蓮縣吉安鄉東海六街71號,117.0,住,,,1100312,土地1建物0車位0,全,4,透天厝,住家用,鋼筋混凝土造,1040417,258.59,4,2,5,有,無,無,31500,122,,0.0,0,含增建或未登記建物。；,RPRNMLRKLHGGFAU76CC
吉安鄉,房地(土地+建物),花蓮縣吉安鄉建國路1段103.105號,305.68,住,,,1100301,土地2建物0車位0,全,4,透天厝,住家用,鋼筋混凝土造,0801218,555.72,29,0,29,有,無,無,45000,81,,0.0,0,,RPSOMLSKLHGGFAU07CC
吉安鄉,房地(土地+建物),花蓮縣吉安鄉宜昌五街35號,226.0,住,,,1100315,土地1建物0車位0,全,4,透天厝,住家用,鋼筋混凝土造,1060802,453.2,5,2,6,有,無,無,65000,143,,0.0,0,,RPXNMLNLLHGGFAU07CC
花蓮市,房地(土地+建物),花蓮縣花蓮市中山路654號,37.0,住,,,1100316,土地1建物1車位0,一層,3,店面(店鋪),住商用,鋼筋混凝土造,0741108,83.98,0,0,0,無,無,無,20000,238,,0.0,0,包含地下層,RPVNMLOLLHGGFAU96CC
新城鄉,房地(土地+建物),花蓮縣新城鄉助人街1巷1號,68.64,住,,,1100328,土地1建物1車位0,全,4,透天厝,住家用,鋼筋混凝土造,0890728,150.76,4,2,3,有,無,有,15000,99,,0.0,0,,RPSNMLKMLHGGFAU98CC
新城鄉,建物,花蓮縣新城鄉民族路85號,0.0,商,,,1100310,土地0建物0車位0,二層,5,套房(1房1廳1衛),住家用,鋼筋混凝土造,1060731,23.53,1,0,1,有,無,有,7300,310,,0.0,0,2樓前房間,RPXOMLKMLHGGFAU96CC
花蓮市,土地,林森段1148-2地號,118.0,商,,,1100330,土地2建物0車位0,,,其他,,,,0.0,0,0,0,有,無,有,28000,237,,0.0,0,含增建或未登記建物。；,RPXNMLQJMHGGFAU27CC
花蓮市,建物,花蓮縣花蓮市南京街272號,0.0,其他,,,1100311,土地0建物0車位0,全,4,透天厝,住商用,鋼筋混凝土造,0690708,70.5,0,0,1,有,無,有,19000,270,,0.0,0,,RPOOMLQJMHGGFAU09CC
花蓮市,房地(土地+建物),花蓮縣花蓮市民國路7號2樓,38.43,住,,,1100310,土地1建物1車位0,二層,7,華廈(10層含以下有電梯),補習班,鋼筋混凝土造,0900223,199.34,0,0,0,無,無,無,16000,80,,0.0,0,,RPSOMLQJMHGGFAU86CC
花蓮市,房地(土地+建物),花蓮縣花蓮市國民五街53-2號,11.79,住,,,1100308,土地1建物1車位0,一層,5,華廈(10層含以下有電梯),住家用,鋼筋混凝土造,0840124,36.64,0,0,0,無,有,無,5600,153,,0.0,0,,RPROMLQJMHGGFAU86DC
花蓮市,房地(土地+建物),花蓮縣花蓮市林政街33巷1弄3號,84.0,住,,,1100327,土地1建物0車位0,全,2,透天厝,住家用,鋼筋混凝土加強磚造,0700107,96.31,3,2,2,有,無,無,17000,177,,0.0,0,,RPUOMLQJMHGGFAU17DC
花蓮市,房地(土地+建物),花蓮縣花蓮市國富二街58號,10.0,住,,,1100327,土地1建物0車位0,全,3,透天厝,住商用,鋼筋混凝土造,0740424,13.22,1,0,1,有,無,有,4500,340,,0.0,0,,RPSNMLRJMHGGFAU86CC
花蓮市,房地(土地+建物),花蓮縣花蓮市中正路119巷1弄8之2號,62.24,住,,,1100327,土地1建物1車位0,三層,4,公寓(5樓含以下無電梯),住家用,鋼筋混凝土造,0710517,159.32999999999998,4,2,2,有,無,無,12000,75,,0.0,0,,RPUOMLRJMHGGFAU17CC
新城鄉,建物,花蓮縣新城鄉民族路71號,0.0,商,,,1100402,土地0建物0車位0,四層,5,套房(1房1廳1衛),住家用,鋼筋混凝土造,1070514,19.74,1,0,1,有,無,有,9800,496,,0.0,0,,RPVOMLSJMHGGFAU37CC
新城鄉,建物,花蓮縣新城鄉民族路89號,0.0,商,,,1100330,土地0建物0車位0,二層,5,套房(1房1廳1衛),住家用,鋼筋混凝土造,1060731,34.15,1,0,1,有,無,有,9500,278,,0.0,0,※2樓前房間含陽台。,RPWOMLSJMHGGFAU47CC
花蓮市,房地(土地+建物),花蓮縣花蓮市和平路362號十樓之三,8.03,商,,,1100309,土地1建物1車位0,十層,12,住宅大樓(11層含以上有電梯),住家用,鋼筋混凝土造,0830315,92.59,2,1,1,有,有,有,13000,140,,0.0,0,含管理費、稅金或水電等費用。；,RPPPMLSJMHGGFAU86CC
花蓮市,房地(土地+建物),花蓮縣花蓮市民族路1號五樓之三,4.51,商,,,1100310,土地1建物1車位0,五層,10,套房(1房1廳1衛),住家用,鋼筋混凝土造,0850202,43.489999999999995,1,0,1,有,有,有,8500,195,,0.0,0,含管理費、稅金或水電等費用。；,RPSPMLSJMHGGFAU17CC
壽豐鄉,房地(土地+建物),花蓮縣壽豐鄉中山路六段49號,114.86,住,,,1100323,土地1建物0車位0,見其他登記事項,2,店面(店鋪),住商用,鋼筋混凝土加強磚造,0750129,141.64,3,2,2,有,無,無,16000,113,,0.0,0,,RPRNMLTJMHGGFAU96CC
花蓮市,房地(土地+建物),花蓮縣花蓮市中山路258號,49.5,商,,,1100315,土地1建物1車位0,三層,4,店面(店鋪),住商用,鋼筋混凝土造,0830330,160.05,0,0,0,無,無,無,20000,125,,0.0,0,,RPQPMLTJMHGGFAU07CC
吉安鄉,房地(土地+建物),花蓮縣吉安鄉南海六街180號,2534.0,,特定農業區,農牧用地,1100330,土地1建物1車位0,見其他登記事項,2,農舍,農舍,鋼筋混凝土造,1031024,538.39,7,2,8,有,無,有,50000,,,0.0,0,,RPPNMLMKMHGGFAU78CC
花蓮市,建物,花蓮縣花蓮市明心街1-22號4樓D室,0.0,住,,,1100414,土地0建物0車位0,四層,,套房(1房1廳1衛),,,,19.83,1,0,1,有,無,有,7500,378,,0.0,0,,RPQNMLQKMHGGFAU66CC
吉安鄉,建物,花蓮縣吉安鄉建國路1段105號,0.0,住,,,1100416,土地0建物0車位0,三層,,套房(1房1廳1衛),,,,90.44,1,0,1,有,無,有,6500,72,,0.0,0,,RPXNMLTKMHGGFAU67CC
吉安鄉,房地(土地+建物),花蓮縣吉安鄉吉興路2段229號,95.84,,鄉村區,乙種建築用地,1100401,土地1建物0車位0,全,3,透天厝,住家用,鋼筋混凝土造,0890926,193.81,4,2,3,有,無,無,17000,88,,0.0,0,,RPXNMLKLMHGGFAU86CC
花蓮市,車位,花蓮縣花蓮市中和街207號B1之1,0.0,住,,,1100406,土地0建物0車位1,,15,其他,商業用,鋼筋混凝土造,0890807,14.09,0,0,0,有,無,無,2300,,坡道平面,14.09,2300,,RPUPMLLLMHGGFAU86CC
花蓮市,車位,花蓮縣花蓮市中和街207號B1之1,0.0,住,,,1100406,土地0建物0車位1,,,其他,,,,14.09,0,0,0,有,無,無,2000,,坡道平面,14.09,2000,,RPVPMLLLMHGGFAU96CC
花蓮市,土地,石壁段988-3地號,2773.78,,一般農業區,農牧用地,1100407,土地1建物0車位0,,,其他,,,,0.0,0,0,0,有,無,有,18000,6,,0.0,0,,RPPPMLLLMHGGFAU09DC
花蓮市,房地(土地+建物),花蓮縣花蓮市國民八街65號5樓1,11.89,住,,,1100408,土地1建物1車位0,五層,6,套房(1房1廳1衛),住家用,鋼筋混凝土造,0781104,52.68,1,0,1,有,無,有,7000,133,,0.0,0,,RPSPMLLLMHGGFAU76DC
花蓮市,建物,花蓮縣花蓮市國民七街51號7樓之20,0.0,商,,,1100327,土地0建物1車位0,七層,12,套房(1房1廳1衛),住家用,鋼筋混凝土造,0831115,26.17,1,0,1,有,有,有,5000,191,,0.0,0,,RPSOMLMLMHGGFAU76DC
新城鄉,房地(土地+建物),花蓮縣新城鄉光復路391號,135.0,住,,,1100405,土地1建物1車位0,全,1,透天厝,商業用,鋼筋混凝土加強磚造,0661221,69.0,0,1,1,有,無,無,10000,145,,0.0,0,,RPQNMLMLMHGGFAU98CC
花蓮市,房地(土地+建物),花蓮縣花蓮市國興二街136號四樓之三,13.58,住,,,1100415,土地1建物1車位0,四層,,套房(1房1廳1衛),,,,23.61,1,1,1,有,有,有,9000,231,,0.0,0,,RPUPMLNLMHGGFAU07CC
花蓮市,房地(土地+建物),花蓮縣花蓮市富裕五街37號5樓2,14.22,住,,,1100416,土地1建物1車位0,五層,,華廈(10層含以下有電梯),,,,18.36,2,2,1,有,無,有,12000,654,,0.0,0,,RPRQMLNLMHGGFAU86CC
花蓮市,房地(土地+建物),花蓮縣花蓮市國盛四街51號8樓之1,5.15,住,,,1100424,土地1建物1車位0,八層,8,套房(1房1廳1衛),住家用,鋼筋混凝土造,0830811,20.44,1,1,1,有,無,有,8000,391,,0.0,0,,RPPOMLQLMHGGFAU76CC
花蓮市,建物,花蓮縣花蓮市建國路105號,0.0,住,,,1100424,土地0建物0車位0,全,4,透天厝,工廠、辦公廳、單身員工宿社舍、貯藏室,鋼筋混凝土造,0801218,90.44,1,0,1,有,無,有,8000,88,,0.0,0,,RPWOMLQLMHGGFAU47CC
花蓮市,土地,林森段2594地號,2442.0,住,,,1100421,土地3建物0車位0,,,其他,,,,0.0,0,0,0,有,無,無,180000,74,,0.0,0,租約內不含該土地地上物,RPOOMLRLMHGGFAU86DC
新城鄉,建物,花蓮縣新城鄉光復路93號,0.0,住,,,1100401,土地0建物0車位0,全,3,透天厝,住商用,鋼筋混凝土造,0680511,16.52,1,1,1,有,無,有,6500,393,,0.0,0,,RPTNMLSLMHGGFAU27CC
花蓮市,建物,花蓮縣花蓮市建國路103號,0.0,住,,,1100426,土地0建物0車位0,全,4,透天厝,住家用,鋼筋混凝土造,0801218,90.0,1,0,1,有,無,有,6500,72,,0.0,0,,RPVNMLSLMHGGFAU47CC
花蓮市,建物,花蓮縣花蓮市中山路231號,0.0,商,,,1100330,土地2建物0車位0,見其他登記事項,10,店面(店鋪),商業用,鋼筋混凝土造,0800521,1650.48,0,0,0,無,有,無,367500,223,,0.0,0,,RPUOMLTLMHGGFAU57CC
新城鄉,建物,花蓮縣新城鄉民族路83號,0.0,商,,,1100429,土地0建物0車位0,五層,5,套房(1房1廳1衛),住家用,鋼筋混凝土造,1070514,53.06,1,0,1,有,無,有,9500,179,,0.0,0,※5樓房間含陽露台。,RPSPMLNJNHGGFAU76CC
新城鄉,建物,花蓮縣新城鄉民族路71號,0.0,商,,,1100502,土地0建物0車位0,二層,5,套房(1房1廳1衛),住家用,鋼筋混凝土造,1070514,13.34,1,0,1,有,無,有,7500,562,,0.0,0,2樓A室。,RPUPMLNJNHGGFAU96CC
花蓮市,房地(土地+建物),花蓮縣花蓮市華廈街40號四樓之3，之5,38.65,住,,,1100430,土地1建物2車位0,見其他登記事項,9,華廈(10層含以下有電梯),住家用,鋼筋混凝土造,0860827,219.32999999999998,5,2,4,有,有,有,22000,100,,0.0,0,,RPRPMLPJNHGGFAU96DC
花蓮市,建物,花蓮縣花蓮市中華路498巷2-1號,0.0,住,,,1100504,土地0建物0車位0,三層,2,套房(1房1廳1衛),住商用,鋼筋混凝土造,0661118,16.52,1,1,1,有,無,有,6500,393,,0.0,0,頂樓加蓋,RPRNMLKKNHGGFAU88CC
吉安鄉,建物,花蓮縣吉安鄉自立路63號,0.0,住,,,1100503,土地0建物0車位0,一層,2,店面(店鋪),住商用,鋼筋混凝土造,0751213,84.31,0,0,0,無,無,無,24916,296,,0.0,0,,RPQPMLKKNHGGFAU98CC
花蓮市,建物,花蓮縣花蓮市中山路176號,0.0,商,,,1100423,土地1建物0車位0,見其他登記事項,3,店面(店鋪),商業用,鋼筋混凝土造,,193.38,0,0,0,無,無,無,80000,414,,0.0,0,,RPOOMLLKNHGGFAU78CC
吉安鄉,房地(土地+建物),花蓮縣吉安鄉明義五街58號,117.13,,鄉村區,乙種建築用地,1100508,土地1建物1車位0,全,1,透天厝,住家用,鋼筋混凝土加強磚造,0740328,59.75,3,2,2,有,無,無,15000,251,,0.0,0,,RPQOMLLKNHGGFAU98CC
花蓮市,房地(土地+建物),花蓮縣花蓮市長安街27號六樓之三,5.7,住,,,1100415,土地1建物1車位0,六層,,套房(1房1廳1衛),,,,29.85,1,0,1,有,有,有,7000,165,,0.0,0,含管理費、稅金或水電等費用。；,RPWOMLLKNHGGFAU96CC
花蓮市,房地(土地+建物),花蓮縣花蓮市中央路三段730號十一樓之十八,4.97,住,,,1100416,土地1建物1車位0,十一層,,套房(1房1廳1衛),,,,28.83,1,0,1,有,有,有,7000,192,,0.0,0,,RPXOMLLKNHGGFAU07CC
花蓮市,房地(土地+建物),花蓮縣花蓮市中興路19號十二樓之一,14.11,商,,,1100416,土地1建物1車位0,十二層,,住宅大樓(11層含以上有電梯),,,,107.96,3,2,2,有,有,有,18000,131,,0.0,0,含管理費、稅金或水電等費用。；,RPPPMLLKNHGGFAU98CC
花蓮市,建物,花蓮縣花蓮市中山路64號,0.0,商,,,1100412,土地0建物0車位0,一層,4,店面(店鋪),住商用,鋼筋混凝土造,0890818,60.34,0,0,1,有,無,無,24000,398,,0.0,0,,RPPOMLMKNHGGFAU98CC
吉安鄉,房地(土地+建物),花蓮縣吉安鄉東海八街54巷6號,80.0,住,,,1100503,土地1建物1車位0,全,3,透天厝,住家用,鋼筋混凝土造,0841205,161.9,4,2,3,有,無,有,13500,83,,0.0,0,,RPQOMLMKNHGGFAU09CC
吉安鄉,建物,花蓮縣吉安鄉建國路一段103號,0.0,住,,,1100511,土地0建物0車位0,四層,4,套房(1房1廳1衛),住家用,鋼筋混凝土造,0801218,92.55,1,1,1,有,無,有,5500,59,,0.0,0,,RPUOMLMKNHGGFAU86CC
吉安鄉,建物,花蓮縣吉安鄉建國路一段103號,0.0,住,,,1100511,土地0建物0車位0,三層,4,套房(1房1廳1衛),住家用,鋼筋混凝土造,0801218,93.0,1,1,1,有,無,有,5500,59,,0.0,0,,RPWOMLMKNHGGFAU07CC
新城鄉,建物,花蓮縣新城鄉復興路189巷13弄3號,0.0,住,,,1100503,土地0建物1車位0,全,4,透天厝,住家用,鋼筋混凝土造,1050624,198.32000000000002,4,2,5,有,無,有,26000,131,,0.0,0,,RPRNMLNKNHGGFAU56CC
新城鄉,房地(土地+建物),花蓮縣新城鄉北埔路194號,60.0,住,,,1100510,土地1建物1車位0,全,3,透天厝,住商用,鋼筋混凝土造,0690503,91.71,6,3,3,有,無,有,13000,142,,0.0,0,,RPOPMLNKNHGGFAU56DC
花蓮市,房地(土地+建物),花蓮縣花蓮市富國路50號,150.0,住,,,1100512,土地1建物1車位0,見其他登記事項,4,店面(店鋪),住商用,鋼筋混凝土造,0940323,333.81,4,2,4,有,無,無,35000,105,,0.0,0,,RPROMLOKNHGGFAU76CC
花蓮市,房地(土地+建物),花蓮縣花蓮市中原路682號,94.0,住,,,1100503,土地1建物1車位0,全,2,透天厝,住商用,鋼筋混凝土加強磚造,0720701,110.61,1,1,2,有,無,有,10000,90,,0.0,0,,RPSOMLOKNHGGFAU86CC
花蓮市,房地(土地+建物),花蓮縣花蓮市美工六街35-1號,1777.0,工,,,1100425,土地1建物0車位0,見其他登記事項,1,工廠,工業用,鋼骨或鋼骨混合造,1100127,1214.52,0,0,0,無,無,無,90000,,,0.0,0,,RPXPMLRKNHGGFAU77CC
吉安鄉,房地(土地+建物),花蓮縣吉安鄉中原路一段267巷19號,78.0,住,,,1100418,土地1建物0車位0,全,4,透天厝,住家用,鋼筋混凝土造,0920606,192.7,4,2,4,有,無,無,21000,109,,0.0,0,,RPPQMLRKNHGGFAU07CC
花蓮市,房地(土地+建物),花蓮縣花蓮市東興路291號,72.93,住,,,1100427,土地1建物1車位0,一層,7,店面(店鋪),店舖,鋼筋混凝土造,0890609,184.67000000000002,0,0,1,有,有,有,10000,54,,0.0,0,,RPRQMLRKNHGGFAU27CC
花蓮市,建物,花蓮縣花蓮市國盛四街102號,0.0,住,,,1100429,土地0建物0車位0,一層,7,店面(店鋪),集合住宅、自用儲藏室、店舖,鋼筋混凝土造,0830412,67.9,0,0,1,有,有,無,8000,118,,0.0,0,,RPTQMLRKNHGGFAU47CC
吉安鄉,房地(土地+建物),花蓮縣吉安鄉東里一街160號三樓之五,11.41,住,,,1100430,土地1建物1車位0,三層,5,套房(1房1廳1衛),住家用,鋼筋混凝土造,0840316,42.730000000000004,1,0,1,有,有,有,7000,164,,0.0,0,,RPUQMLRKNHGGFAU57CC
花蓮市,房地(土地+建物),花蓮縣花蓮市廣東街48號,78.0,住,,,1100515,土地1建物1車位0,全,2,透天厝,住家用,鋼筋混凝土造,0731231,92.97,3,2,2,有,無,有,11000,118,,0.0,0,,RPRNMLSKNHGGFAU07CC
花蓮市,房地(土地+建物),花蓮縣花蓮市上海街35-1號,27.0,商,,,1100514,土地1建物1車位0,全,3,透天厝,住商用,鋼筋混凝土造,0690401,108.56,0,0,0,無,無,有,20000,184,,0.0,0,,RPSNMLSKNHGGFAU17CC
吉安鄉,建物,花蓮縣吉安鄉建國路一段105號,0.0,住,,,1100514,土地0建物0車位0,四層,4,套房(1房1廳1衛),工廠、辦公廳、單身員工宿社舍、貯藏室,鋼筋混凝土造,0801218,90.0,1,0,1,有,無,有,7000,78,,0.0,0,,RPTNMLSKNHGGFAU27CC
新城鄉,建物,花蓮縣新城鄉光復路93號,0.0,住,,,1100504,土地0建物0車位0,四層,3,套房(1房1廳1衛),住商用,鋼筋混凝土造,0680511,19.83,1,1,1,有,無,有,6800,343,,0.0,0,頂樓加蓋,RPXNMLSKNHGGFAU67CC
新城鄉,建物,花蓮縣新城鄉光復路93號,0.0,住,,,1100507,土地0建物0車位0,二層,3,套房(1房1廳1衛),住商用,鋼筋混凝土造,0680511,16.52,1,1,1,有,無,有,4500,272,,0.0,0,,RPPOMLSKNHGGFAU96CC
花蓮市,房地(土地+建物),花蓮縣花蓮市成功街185號,100.0,住,,,1100513,土地1建物0車位0,見其他登記事項,4,店面(店鋪),住商用,鋼筋混凝土造,,284.76,0,0,0,無,無,無,30000,105,,0.0,0,,RPPNMLTKNHGGFAU96CC
花蓮市,房地(土地+建物),花蓮縣花蓮市自強路573號,206.0,住,,,1100512,土地1建物1車位0,一層,3,店面(店鋪),住商用,鋼筋混凝土造,0720628,39.32,0,0,0,無,無,無,20000,509,,0.0,0,,RPOOMLTKNHGGFAU96CC
新城鄉,建物,花蓮縣新城鄉光復路93號,0.0,住,,,1100514,土地0建物0車位0,三層,3,套房(1房1廳1衛),住商用,鋼筋混凝土造,0680511,16.52,1,1,1,有,無,有,4500,272,,0.0,0,,RPTQMLKLNHGGFAU86CC
新城鄉,建物,花蓮縣新城鄉光復路93號,0.0,住,,,1100514,土地0建物0車位0,四層,3,套房(1房1廳1衛),住商用,鋼筋混凝土造,0680511,16.52,1,1,1,有,無,有,4000,242,,0.0,0,頂樓加蓋,RPUQMLKLNHGGFAU96CC
花蓮市,房地(土地+建物),花蓮縣花蓮市自強路573號,44.17,住,,,1100512,土地1建物0車位0,一層,3,店面(店鋪),住商用,鋼筋混凝土造,0720628,89.97,0,0,0,無,無,無,20000,222,,0.0,0,,RPSNMLOLNHGGFAU86CC
花蓮市,房地(土地+建物),花蓮縣花蓮市國民八街5號4樓之7,12.31,商,,,1100510,土地1建物0車位0,四層,12,住宅大樓(11層含以上有電梯),集合住宅,鋼筋混凝土造,1080925,73.31,2,1,1,有,無,無,18000,246,,0.0,0,,RPPNMLPLNHGGFAU66CC
吉安鄉,房地(土地+建物),花蓮縣吉安鄉太昌路372巷20號,84.0,住,,,1100524,土地1建物0車位0,全,2,透天厝,住家用,鋼筋混凝土造,0831018,104.66,3,2,3,有,無,無,12000,115,,0.0,0,,RPVNMLPLNHGGFAU27CC
吉安鄉,建物,花蓮縣吉安鄉建國路一段103號,0.0,住,,,1100525,土地0建物0車位0,屋頂突出物,4,套房(1房1廳1衛),住家用,鋼筋混凝土造,0801218,5.88,1,0,1,有,無,無,6500,1105,,0.0,0,,RPVOMLPLNHGGFAU37CC
新城鄉,建物,花蓮縣新城鄉民族路73號,0.0,商,,,1100520,土地0建物0車位0,三層,5,套房(1房1廳1衛),住家用,鋼筋混凝土造,1070514,40.26,1,0,1,有,無,無,9800,243,,0.0,0,,RPUPMLPLNHGGFAU37CC
新城鄉,建物,花蓮縣新城鄉民族路83號,0.0,商,,,1100426,土地0建物0車位0,四層,5,套房(1房1廳1衛),住家用,鋼筋混凝土造,1070514,53.05,1,0,1,有,無,無,9500,179,,0.0,0,四樓後房間含陽台。,RPVPMLPLNHGGFAU47CC
新城鄉,建物,花蓮縣新城鄉民族路85號,0.0,商,,,1100511,土地0建物0車位0,四層,5,套房(1房1廳1衛),住家用,鋼筋混凝土造,1060731,22.38,1,0,1,有,無,無,7500,335,,0.0,0,,RPWPMLPLNHGGFAU57CC
吉安鄉,建物,花蓮縣吉安鄉建國路1段105號,0.0,住,,,1100524,土地0建物0車位0,四層,4,套房(1房1廳1衛),工廠、辦公廳、單身員工宿社舍、貯藏室,鋼筋混凝土造,0801218,90.0,1,0,1,有,無,無,7000,78,,0.0,0,,RPRNMLQLNHGGFAU96CC
花蓮市,房地(土地+建物),花蓮縣花蓮市球崙二路211號4樓之3,11.53,住,,,1100524,土地1建物0車位0,四層,9,華廈(10層含以下有電梯),住家用,鋼筋混凝土造,0860827,63.14,2,1,1,有,無,無,10000,158,,0.0,0,,RPSNMLQLNHGGFAU07CC
花蓮市,房地(土地+建物)+車位,花蓮縣花蓮市國富十七街10號五樓之五,22.37,住,,,1100508,土地1建物1車位0,五層,6,華廈(10層含以下有電梯),住家用,鋼筋混凝土造,0810121,122.68,3,2,1,有,有,無,17800,145,坡道平面,17.62,0,,RPUNMLQLNHGGFAU27CC
花蓮市,建物,花蓮縣花蓮市中華路458號,0.0,住,,,1100427,土地1建物0車位0,見其他登記事項,2,店面(店鋪),住商用,鋼筋混凝土造,0921224,295.87,0,0,1,有,無,無,70000,237,,0.0,0,,RPSQMLQLNHGGFAU37CC
花蓮市,房地(土地+建物),花蓮縣花蓮市德安六街103號2樓之2,14.37,住,,,1100517,土地1建物0車位0,二層,10,華廈(10層含以下有電梯),住家用,鋼筋混凝土造,0870403,83.86,2,2,1,有,有,無,13000,155,,0.0,0,,RPQNMLRLNHGGFAU96CC
吉安鄉,房地(土地+建物),花蓮縣吉安鄉勝利105之27號,116.13,商,,,1100427,土地1建物0車位0,一層,2,店面(店鋪),住商用,鋼筋混凝土造,0661013,60.13,0,0,0,無,無,無,90000,1497,,0.0,0,含增建或未登記建物。；,RPSNMLRLNHGGFAU17CC
吉安鄉,建物,花蓮縣吉安鄉建國路1段105號,0.0,住,,,1100528,土地0建物0車位0,四層,4,套房(1房1廳1衛),工廠、辦公廳、單身員工宿社舍、貯藏室,鋼筋混凝土造,0801218,90.0,1,0,1,有,無,無,7000,78,,0.0,0,,RPROMLLMNHGGFAU66CC
吉安鄉,建物,花蓮縣吉安鄉建國路一段103號,0.0,住,,,1100531,土地0建物0車位0,四層,4,套房(1房1廳1衛),住家用,鋼筋混凝土造,0801218,92.55,1,0,1,有,無,無,7000,76,,0.0,0,,RPPPMLLMNHGGFAU56CC
